SOURCE_YEAR,OBJECTID,CRASH_NUMB,CITY_TOWN_NAME,CRASH_DATE_TEXT,CRASH_DATETIME,CRASH_STATUS,CRASH_SEVERITY_DESCR,MAX_INJR_SVRTY_CL,NUMB_VEHC,NUMB_NONFATAL_INJR,NUMB_FATAL_INJR,POLC_AGNCY_TYPE_DESCR,MANR_COLL_DESCR,VEHC_MNVR_ACTN_CL,VEHC_TRVL_DIRC_CL,VEHC_SEQ_EVENTS_CL,AMBNT_LIGHT_DESCR,WEATH_COND_DESCR,ROAD_SURF_COND_DESCR,FIRST_HRMF_EVENT_DESCR,MOST_HRMFL_EVT_CL,DRVR_CNTRB_CIRC_CL,VEHC_CONFIG_CL,STREET_NUMB,RDWY,DIST_DIRC_FROM_INT,NEAR_INT_RDWY,LANDMARK,RDWY_JNCT_TYPE_DESCR,TRAF_CNTRL_DEVC_TYPE_DESCR,TRAFY_DESCR_DESCR,JURISDICTN,FIRST_HRMF_EVENT_LOC_DESCR,NON_MTRST_TYPE_CL,IS_GEOCODED,GEOCODING_METHOD_NAME,X,Y,LAT,LON,YEAR,DRVR_DISTRACTED_CL,DISTRICT_NUM,RPA_ABBR,VEHC_EMER_USE_CL,VEHC_TOWED_FROM_SCENE_CL,CNTY_NAME,FMCSA_RPTBL_CL,FMCSA_RPTBL,HIT_RUN_DESCR,ROAD_CNTRB_DESCR,SCHL_BUS_RELD_DESCR,SPEED_LIMIT,TRAF_CNTRL_DEVC_FUNC_DESCR,WORK_ZONE_RELD_DESCR,AADT,AADT_YEAR,PK_PCT_SUT,AV_PCT_SUT,PK_PCT_CT,AV_PCT_CT,CURB,LT_SIDEWLK,RT_SIDEWLK,SHLDR_LT_W,SHLDR_LT_T,SURFACE_WD,SURFACE_TP,SHLDR_RT_W,SHLDR_RT_T,NUM_LANES,OPP_LANES,MED_WIDTH,MED_TYPE,URBAN_TYPE,F_CLASS,URBAN_AREA,FACILITY,OPERATION,CONTROL,SPEED_LIM,STREETNAME,FROMSTREETNAME,TOSTREETNAME,CITY,STRUCT_CND,TERRAIN,AADT_DERIV,STATN_NUM,OP_DIR_SL,SHLDR_UL_T,SHLDR_UL_W,F_F_CLASS,VEHC_UNIT_NUMB,ALC_SUSPD_TYPE_DESCR,DRIVER_AGE,DRVR_CNTRB_CIRC_DESCR,DRIVER_DISTRACTED_TYPE_DESCR,DRVR_LCN_STATE,DRUG_SUSPD_TYPE_DESCR,EMERGENCY_USE_DESC,FMCSA_RPTBL_VL,HAZ_MAT_PLACARD_DESCR,MAX_INJR_SVRTY_VL,MOST_HRMF_EVENT,TOTAL_OCCPT_IN_VEHC,VEHC_MANR_ACT_DESCR,VEHC_CONFG_DESCR,VEHC_MOST_DMGD_AREA,OWNER_ADDR_CITY_TOWN,OWNER_ADDR_STATE,VEHC_REG_STATE,VEHC_REG_TYPE_CODE,VEHC_SEQ_EVENTS,VEHC_TOWED_FROM_SCENE,VEHICLE_MAKE_DESCR,VEHICLE_MODEL_DESCR,DRIVER_VIOLATION_CL,TRVL_DIRC_DESCR,OBJECTID_1,TARGET_STREET,CRASH_YEAR,CRASH_MONTH,CRASH_DAY,CRASH_WEEKDAY,HAS_INJURY
2023,4878902,5198279,BOSTON,01/05/2023,2023-01-05 18:18:00+00:00,OPEN,PROPERTY DAMAGE ONLY (NONE INJURED),NO APPARENT INJURY (O),2,0,0,STATE POLICE,REAR-END,V1: TRAVELLING STRAIGHT AHEAD / V2: SLOWING OR STOPPED IN TRAFFIC,V1: N  / V2: N,V1:(COLLISION WITH MOTOR VEHICLE IN TRAFFIC) V2:(COLLISION WITH MOTOR VEHICLE IN TRAFFIC),DARK - LIGHTED ROADWAY,NOT REPORTED,WET,COLLISION WITH MOTOR VEHICLE IN TRAFFIC,V1:(COLLISION WITH MOTOR VEHICLE IN TRAFFIC) / V2:(COLLISION WITH MOTOR VEHICLE IN TRAFFIC),D1: (FOLLOWED TOO CLOSELY)  / D2: (NO IMPROPER DRIVING),"V1:(PASSENGER CAR) / V2:(LIGHT TRUCK(VAN, MINI-VAN, PICKUP, SPORT UTILITY))",,CENTRE STREET,,,,NOT AT JUNCTION,TRAFFIC CONTROL SIGNAL,"TWO-WAY, DIVIDED, POSITIVE MEDIAN BARRIER",DEPARTMENT OF CONSERVATION AND RECREATION,ROADWAY,,YES,OPERATOR DESIGNATED,230308.3204538,894121.08677849,42.296982,-71.13245421,2023,D1: NOT DISTRACTED / D2: NOT DISTRACTED,6,MAPC,V1:(NO) / V2:(NO),"V1:(YES, OTHER REASON NOT DISABLED) / V2:(NO)",SUFFOLK,,,NO HIT AND RUN,,"NO, SCHOOL BUS NOT INVOLVED",35.0,"YES, DEVICE FUNCTIONING",NO,31806.0,2020,0.558,1463,0.155,350,ALL CURBS (DIVIDED HIGHWAY),0,8,0,NO SHOULDER,22,BITUMINOUS CONCRETE ROAD,0,NO SHOULDER,2,2,3,RAISED MEDIAN,LARGE URBANIZED AREA,RURAL OR URBAN PRINCIPAL ARTERIAL,BOSTON (MA-NH-RI),MAINLINE ROADWAY,TWO-WAY TRAFFIC,NO ACCESS CONTROL,35.0,CENTRE STREET,WEST ROXBURY CENTRE STREET ROTARY,MURRAY CIRCLE,BOSTON,FAIR,LEVEL TERRAIN,PULLED BACK FROM HPMS NETWORK ESTIMATION ROUTINE,,0,0,0,PRINCIPAL ARTERIAL - OTHER,1,NO,29.0,"DCC1:FOLLOWED TOO CLOSELY, DCC2:NOT REPORTED",NOT DISTRACTED,MA,NO,NO,,NOT REPORTED,NO APPARENT INJURY (O),COLLISION WITH MOTOR VEHICLE IN TRAFFIC,1,TRAVELLING STRAIGHT AHEAD,PASSENGER CAR,MDA1:CENTER FRONT,DUDLEY,MA,MA,PAN,SEQ1:COLLISION WITH MOTOR VEHICLE IN TRAFFIC,"YES, OTHER REASON NOT DISABLED",HONDA,,,NORTHBOUND,,CENTRE STREET,2023,1,5,Thursday,False
2023,4878902,5198279,BOSTON,01/05/2023,2023-01-05 18:18:00+00:00,OPEN,PROPERTY DAMAGE ONLY (NONE INJURED),NO APPARENT INJURY (O),2,0,0,STATE POLICE,REAR-END,V1: TRAVELLING STRAIGHT AHEAD / V2: SLOWING OR STOPPED IN TRAFFIC,V1: N  / V2: N,V1:(COLLISION WITH MOTOR VEHICLE IN TRAFFIC) V2:(COLLISION WITH MOTOR VEHICLE IN TRAFFIC),DARK - LIGHTED ROADWAY,NOT REPORTED,WET,COLLISION WITH MOTOR VEHICLE IN TRAFFIC,V1:(COLLISION WITH MOTOR VEHICLE IN TRAFFIC) / V2:(COLLISION WITH MOTOR VEHICLE IN TRAFFIC),D1: (FOLLOWED TOO CLOSELY)  / D2: (NO IMPROPER DRIVING),"V1:(PASSENGER CAR) / V2:(LIGHT TRUCK(VAN, MINI-VAN, PICKUP, SPORT UTILITY))",,CENTRE STREET,,,,NOT AT JUNCTION,TRAFFIC CONTROL SIGNAL,"TWO-WAY, DIVIDED, POSITIVE MEDIAN BARRIER",DEPARTMENT OF CONSERVATION AND RECREATION,ROADWAY,,YES,OPERATOR DESIGNATED,230308.3204538,894121.08677849,42.296982,-71.13245421,2023,D1: NOT DISTRACTED / D2: NOT DISTRACTED,6,MAPC,V1:(NO) / V2:(NO),"V1:(YES, OTHER REASON NOT DISABLED) / V2:(NO)",SUFFOLK,,,NO HIT AND RUN,,"NO, SCHOOL BUS NOT INVOLVED",35.0,"YES, DEVICE FUNCTIONING",NO,31806.0,2020,0.558,1463,0.155,350,ALL CURBS (DIVIDED HIGHWAY),0,8,0,NO SHOULDER,22,BITUMINOUS CONCRETE ROAD,0,NO SHOULDER,2,2,3,RAISED MEDIAN,LARGE URBANIZED AREA,RURAL OR URBAN PRINCIPAL ARTERIAL,BOSTON (MA-NH-RI),MAINLINE ROADWAY,TWO-WAY TRAFFIC,NO ACCESS CONTROL,35.0,CENTRE STREET,WEST ROXBURY CENTRE STREET ROTARY,MURRAY CIRCLE,BOSTON,FAIR,LEVEL TERRAIN,PULLED BACK FROM HPMS NETWORK ESTIMATION ROUTINE,,0,0,0,PRINCIPAL ARTERIAL - OTHER,2,NO,41.0,"DCC1:NO IMPROPER DRIVING, DCC2:NOT REPORTED",NOT DISTRACTED,RI,NO,NO,,NOT REPORTED,NO APPARENT INJURY (O),COLLISION WITH MOTOR VEHICLE IN TRAFFIC,1,SLOWING OR STOPPED IN TRAFFIC,"LIGHT TRUCK(VAN, MINI-VAN, PICKUP, SPORT UTILITY)",MDA1:CENTER REAR,OAKLAND,RI,RI,,SEQ1:COLLISION WITH MOTOR VEHICLE IN TRAFFIC,NO,LINCOLN,,,NORTHBOUND,,CENTRE STREET,2023,1,5,Thursday,False
2023,4884470,5203957,BOSTON,01/06/2023,2023-01-06 07:20:00+00:00,OPEN,NON-FATAL INJURY,POSSIBLE INJURY (C),2,1,0,STATE POLICE,"SIDESWIPE, SAME DIRECTION",V1: CHANGING LANES / V2: TRAVELLING STRAIGHT AHEAD,V1: E  / V2: E,V1:(COLLISION WITH MOTOR VEHICLE IN TRAFFIC) V2:(COLLISION WITH MOTOR VEHICLE IN TRAFFIC),DAWN,"SLEET, HAIL (FREEZING RAIN OR DRIZZLE)",WET,COLLISION WITH MOTOR VEHICLE IN TRAFFIC,V1:(COLLISION WITH MOTOR VEHICLE IN TRAFFIC) / V2:(COLLISION WITH MOTOR VEHICLE IN TRAFFIC),D2: (NO IMPROPER DRIVING),V1:(PASSENGER CAR) / V2:(PASSENGER CAR),,CENTRE STREET,,ALLANDALE STREET,,NOT AT JUNCTION,NO CONTROLS,"TWO-WAY, DIVIDED, POSITIVE MEDIAN BARRIER",DEPARTMENT OF CONSERVATION AND RECREATION,ROADWAY,,YES,OPERATOR DESIGNATED,230684.36607674,894463.8157266,42.30005285,-71.12787587,2023,D2: NOT DISTRACTED,6,MAPC,V1:(NO) / V2:(NO),"V1:(NO) / V2:(YES, VEHICLE OR TRAILER DISABLED)",SUFFOLK,,,"YES, HIT AND RUN",,"NO, SCHOOL BUS NOT INVOLVED",35.0,NOT REPORTED,NO,31806.0,2020,0.558,1463,0.155,350,ALL CURBS (DIVIDED HIGHWAY),0,8,0,NO SHOULDER,22,BITUMINOUS CONCRETE ROAD,0,NO SHOULDER,2,2,3,RAISED MEDIAN,LARGE URBANIZED AREA,RURAL OR URBAN PRINCIPAL ARTERIAL,BOSTON (MA-NH-RI),MAINLINE ROADWAY,TWO-WAY TRAFFIC,NO ACCESS CONTROL,35.0,CENTRE STREET,WEST ROXBURY CENTRE STREET ROTARY,MURRAY CIRCLE,BOSTON,FAIR,LEVEL TERRAIN,PULLED BACK FROM HPMS NETWORK ESTIMATION ROUTINE,,0,0,0,PRINCIPAL ARTERIAL - OTHER,1,NOT REPORTED,,DCC1:NOT REPORTED,NOT REPORTED,,NOT REPORTED,NO,,NOT REPORTED,NOT REPORTED,COLLISION WITH MOTOR VEHICLE IN TRAFFIC,1,CHANGING LANES,PASSENGER CAR,MDA1:LEFT FRONT,,MA,MA,,SEQ1:COLLISION WITH MOTOR VEHICLE IN TRAFFIC,NO,HONDA,,,EASTBOUND,,CENTRE STREET,2023,1,6,Friday,True
2023,4884470,5203957,BOSTON,01/06/2023,2023-01-06 07:20:00+00:00,OPEN,NON-FATAL INJURY,POSSIBLE INJURY (C),2,1,0,STATE POLICE,"SIDESWIPE, SAME DIRECTION",V1: CHANGING LANES / V2: TRAVELLING STRAIGHT AHEAD,V1: E  / V2: E,V1:(COLLISION WITH MOTOR VEHICLE IN TRAFFIC) V2:(COLLISION WITH MOTOR VEHICLE IN TRAFFIC),DAWN,"SLEET, HAIL (FREEZING RAIN OR DRIZZLE)",WET,COLLISION WITH MOTOR VEHICLE IN TRAFFIC,V1:(COLLISION WITH MOTOR VEHICLE IN TRAFFIC) / V2:(COLLISION WITH MOTOR VEHICLE IN TRAFFIC),D2: (NO IMPROPER DRIVING),V1:(PASSENGER CAR) / V2:(PASSENGER CAR),,CENTRE STREET,,ALLANDALE STREET,,NOT AT JUNCTION,NO CONTROLS,"TWO-WAY, DIVIDED, POSITIVE MEDIAN BARRIER",DEPARTMENT OF CONSERVATION AND RECREATION,ROADWAY,,YES,OPERATOR DESIGNATED,230684.36607674,894463.8157266,42.30005285,-71.12787587,2023,D2: NOT DISTRACTED,6,MAPC,V1:(NO) / V2:(NO),"V1:(NO) / V2:(YES, VEHICLE OR TRAILER DISABLED)",SUFFOLK,,,"YES, HIT AND RUN",,"NO, SCHOOL BUS NOT INVOLVED",35.0,NOT REPORTED,NO,31806.0,2020,0.558,1463,0.155,350,ALL CURBS (DIVIDED HIGHWAY),0,8,0,NO SHOULDER,22,BITUMINOUS CONCRETE ROAD,0,NO SHOULDER,2,2,3,RAISED MEDIAN,LARGE URBANIZED AREA,RURAL OR URBAN PRINCIPAL ARTERIAL,BOSTON (MA-NH-RI),MAINLINE ROADWAY,TWO-WAY TRAFFIC,NO ACCESS CONTROL,35.0,CENTRE STREET,WEST ROXBURY CENTRE STREET ROTARY,MURRAY CIRCLE,BOSTON,FAIR,LEVEL TERRAIN,PULLED BACK FROM HPMS NETWORK ESTIMATION ROUTINE,,0,0,0,PRINCIPAL ARTERIAL - OTHER,2,NO,61.0,"DCC1:NO IMPROPER DRIVING, DCC2:NOT REPORTED",NOT DISTRACTED,MA,NO,NO,,NOT REPORTED,POSSIBLE INJURY (C),COLLISION WITH MOTOR VEHICLE IN TRAFFIC,1,TRAVELLING STRAIGHT AHEAD,PASSENGER CAR,MDA1:RIGHT FRONT,,,MA,PAN,SEQ1:COLLISION WITH MOTOR VEHICLE IN TRAFFIC,"YES, VEHICLE OR TRAILER DISABLED",TOYOTA,,,EASTBOUND,,CENTRE STREET,2023,1,6,Friday,True
2023,4884496,5203931,BOSTON,01/06/2023,2023-01-06 07:55:00+00:00,OPEN,NON-FATAL INJURY,POSSIBLE INJURY (C),2,1,0,STATE POLICE,REAR-END,V1: SLOWING OR STOPPED IN TRAFFIC / V2: SLOWING OR STOPPED IN TRAFFIC,V1: W  / V2: W,V1:(COLLISION WITH MOTOR VEHICLE IN TRAFFIC) V2:(COLLISION WITH MOTOR VEHICLE IN TRAFFIC),DAWN,"SLEET, HAIL (FREEZING RAIN OR DRIZZLE)",WET,COLLISION WITH MOTOR VEHICLE IN TRAFFIC,V1:(COLLISION WITH MOTOR VEHICLE IN TRAFFIC) / V2:(COLLISION WITH MOTOR VEHICLE IN TRAFFIC),D1: (FOLLOWED TOO CLOSELY)  / D2: (NO IMPROPER DRIVING),V1:(PASSENGER CAR) / V2:(PASSENGER CAR),1205,CENTRE STREET RTE UNKNOW,,,,NOT AT JUNCTION,NO CONTROLS,"TWO-WAY, DIVIDED, POSITIVE MEDIAN BARRIER",DEPARTMENT OF CONSERVATION AND RECREATION,ROADWAY,,YES,AT ADDRESS,230486.22750886,894240.52339177,42.29805035,-71.1302905,2023,D2: NOT DISTRACTED,6,MAPC,V1:(NO) / V2:(NO),V1:(NO) / V2:(NO),SUFFOLK,,,NO HIT AND RUN,"ROAD SURFACE CONDITION (WET, ICY, SNOW, SLUSH, ETC.)","NO, SCHOOL BUS NOT INVOLVED",35.0,NOT REPORTED,NO,33898.0,2009,3,3,2,2,ALL CURBS (DIVIDED HIGHWAY),0,8,0,NO SHOULDER,22,BITUMINOUS CONCRETE ROAD,0,NO SHOULDER,2,2,3,RAISED MEDIAN,LARGE URBANIZED AREA,RURAL OR URBAN PRINCIPAL ARTERIAL,BOSTON (MA-NH-RI),MAINLINE ROADWAY,TWO-WAY TRAFFIC,NO ACCESS CONTROL,30.0,CENTRE STREET,WEST ROXBURY CENTRE STREET ROTARY,MURRAY CIRCLE,BOSTON,FAIR,LEVEL TERRAIN,ESTIMATE,8536,0,0,0,PRINCIPAL ARTERIAL - OTHER,1,NO,47.0,"DCC1:FOLLOWED TOO CLOSELY, DCC2:NOT REPORTED",NOT REPORTED,MA,NO,NO,,NOT REPORTED,NO APPARENT INJURY (O),COLLISION WITH MOTOR VEHICLE IN TRAFFIC,1,SLOWING OR STOPPED IN TRAFFIC,PASSENGER CAR,MDA1:CENTER FRONT,WEST ROXBURY,MA,MA,PAN,SEQ1:COLLISION WITH MOTOR VEHICLE IN TRAFFIC,NO,BMW,,"V1: (720 906 B),(90 11 A)",WESTBOUND,,CENTRE STREET,2023,1,6,Friday,True
2023,4884496,5203931,BOSTON,01/06/2023,2023-01-06 07:55:00+00:00,OPEN,NON-FATAL INJURY,POSSIBLE INJURY (C),2,1,0,STATE POLICE,REAR-END,V1: SLOWING OR STOPPED IN TRAFFIC / V2: SLOWING OR STOPPED IN TRAFFIC,V1: W  / V2: W,V1:(COLLISION WITH MOTOR VEHICLE IN TRAFFIC) V2:(COLLISION WITH MOTOR VEHICLE IN TRAFFIC),DAWN,"SLEET, HAIL (FREEZING RAIN OR DRIZZLE)",WET,COLLISION WITH MOTOR VEHICLE IN TRAFFIC,V1:(COLLISION WITH MOTOR VEHICLE IN TRAFFIC) / V2:(COLLISION WITH MOTOR VEHICLE IN TRAFFIC),D1: (FOLLOWED TOO CLOSELY)  / D2: (NO IMPROPER DRIVING),V1:(PASSENGER CAR) / V2:(PASSENGER CAR),1205,CENTRE STREET RTE UNKNOW,,,,NOT AT JUNCTION,NO CONTROLS,"TWO-WAY, DIVIDED, POSITIVE MEDIAN BARRIER",DEPARTMENT OF CONSERVATION AND RECREATION,ROADWAY,,YES,AT ADDRESS,230486.22750886,894240.52339177,42.29805035,-71.1302905,2023,D2: NOT DISTRACTED,6,MAPC,V1:(NO) / V2:(NO),V1:(NO) / V2:(NO),SUFFOLK,,,NO HIT AND RUN,"ROAD SURFACE CONDITION (WET, ICY, SNOW, SLUSH, ETC.)","NO, SCHOOL BUS NOT INVOLVED",35.0,NOT REPORTED,NO,33898.0,2009,3,3,2,2,ALL CURBS (DIVIDED HIGHWAY),0,8,0,NO SHOULDER,22,BITUMINOUS CONCRETE ROAD,0,NO SHOULDER,2,2,3,RAISED MEDIAN,LARGE URBANIZED AREA,RURAL OR URBAN PRINCIPAL ARTERIAL,BOSTON (MA-NH-RI),MAINLINE ROADWAY,TWO-WAY TRAFFIC,NO ACCESS CONTROL,30.0,CENTRE STREET,WEST ROXBURY CENTRE STREET ROTARY,MURRAY CIRCLE,BOSTON,FAIR,LEVEL TERRAIN,ESTIMATE,8536,0,0,0,PRINCIPAL ARTERIAL - OTHER,2,NO,50.0,"DCC1:NO IMPROPER DRIVING, DCC2:NOT REPORTED",NOT DISTRACTED,MA,NO,NO,,NOT REPORTED,POSSIBLE INJURY (C),COLLISION WITH MOTOR VEHICLE IN TRAFFIC,1,SLOWING OR STOPPED IN TRAFFIC,PASSENGER CAR,MDA1:CENTER REAR,BOSTON,MA,MA,PAN,SEQ1:COLLISION WITH MOTOR VEHICLE IN TRAFFIC,NO,TOYOTA,,"V1: (720 906 B),(90 11 A)",WESTBOUND,,CENTRE STREET,2023,1,6,Friday,True
2023,4884982,5204758,BOSTON,01/16/2023,2023-01-16 17:40:00+00:00,OPEN,NON-FATAL INJURY,POSSIBLE INJURY (C),3,1,0,STATE POLICE,REAR-END,V1: TRAVELLING STRAIGHT AHEAD / V2: SLOWING OR STOPPED IN TRAFFIC / V3: SLOWING OR STOPPED IN TRAFFIC,V1: N  / V2: N  / V3: N,V1:(COLLISION WITH MOTOR VEHICLE IN TRAFFIC) V2:(COLLISION WITH MOTOR VEHICLE IN TRAFFIC) V3:(COLLISION WITH MOTOR VEHICLE IN TRAFFIC),DARK - LIGHTED ROADWAY,CLOUDY/RAIN,WET,COLLISION WITH MOTOR VEHICLE IN TRAFFIC,V1:(COLLISION WITH MOTOR VEHICLE IN TRAFFIC) / V2:(COLLISION WITH MOTOR VEHICLE IN TRAFFIC) / V3:(COLLISION WITH MOTOR VEHICLE IN TRAFFIC),D1: (INATTENTION)  / D2: (NO IMPROPER DRIVING)  / D3: (NO IMPROPER DRIVING),V1:(PASSENGER CAR) / V2:(PASSENGER CAR) / V3:(PASSENGER CAR),920,CENTRE STREET RTE UNKNOW S,,,,T-INTERSECTION,TRAFFIC CONTROL SIGNAL,"TWO-WAY, DIVIDED, UNPROTECTED MEDIAN",DEPARTMENT OF CONSERVATION AND RECREATION,ROADWAY,,YES,AT ADDRESS,231115.97953213,895373.90573893,42.30822914,-71.12259271,2023,D2: NOT DISTRACTED / D3: NOT DISTRACTED,6,MAPC,V1:(NO) / V2:(NO) / V3:(NO),"V1:(YES, VEHICLE OR TRAILER DISABLED) / V2:(YES, VEHICLE OR TRAILER DISABLED) / V3:(NO)",SUFFOLK,,,NO HIT AND RUN,"ROAD SURFACE CONDITION (WET, ICY, SNOW, SLUSH, ETC.)","NO, SCHOOL BUS NOT INVOLVED",25.0,"YES, DEVICE FUNCTIONING",NO,31806.0,2020,0.558,1463,0.155,350,ALL CURBS (DIVIDED HIGHWAY),0,8,0,NO SHOULDER,22,BITUMINOUS CONCRETE ROAD,0,NO SHOULDER,2,2,3,RAISED MEDIAN,LARGE URBANIZED AREA,RURAL OR URBAN PRINCIPAL ARTERIAL,BOSTON (MA-NH-RI),MAINLINE ROADWAY,TWO-WAY TRAFFIC,NO ACCESS CONTROL,35.0,CENTRE STREET,WEST ROXBURY CENTRE STREET ROTARY,MURRAY CIRCLE,BOSTON,FAIR,LEVEL TERRAIN,PULLED BACK FROM HPMS NETWORK ESTIMATION ROUTINE,,0,0,0,PRINCIPAL ARTERIAL - OTHER,1,NO,70.0,"DCC1:INATTENTION, DCC2:NOT REPORTED",NOT REPORTED,MA,NO,NO,,NOT REPORTED,NO APPARENT INJURY (O),COLLISION WITH MOTOR VEHICLE IN TRAFFIC,1,TRAVELLING STRAIGHT AHEAD,PASSENGER CAR,MDA1:CENTER FRONT,EVERETT,MA,MA,PAN,SEQ1:COLLISION WITH MOTOR VEHICLE IN TRAFFIC,"YES, VEHICLE OR TRAILER DISABLED",TOYOTA,,,NORTHBOUND,,CENTRE STREET,2023,1,16,Monday,True
2023,4884982,5204758,BOSTON,01/16/2023,2023-01-16 17:40:00+00:00,OPEN,NON-FATAL INJURY,POSSIBLE INJURY (C),3,1,0,STATE POLICE,REAR-END,V1: TRAVELLING STRAIGHT AHEAD / V2: SLOWING OR STOPPED IN TRAFFIC / V3: SLOWING OR STOPPED IN TRAFFIC,V1: N  / V2: N  / V3: N,V1:(COLLISION WITH MOTOR VEHICLE IN TRAFFIC) V2:(COLLISION WITH MOTOR VEHICLE IN TRAFFIC) V3:(COLLISION WITH MOTOR VEHICLE IN TRAFFIC),DARK - LIGHTED ROADWAY,CLOUDY/RAIN,WET,COLLISION WITH MOTOR VEHICLE IN TRAFFIC,V1:(COLLISION WITH MOTOR VEHICLE IN TRAFFIC) / V2:(COLLISION WITH MOTOR VEHICLE IN TRAFFIC) / V3:(COLLISION WITH MOTOR VEHICLE IN TRAFFIC),D1: (INATTENTION)  / D2: (NO IMPROPER DRIVING)  / D3: (NO IMPROPER DRIVING),V1:(PASSENGER CAR) / V2:(PASSENGER CAR) / V3:(PASSENGER CAR),920,CENTRE STREET RTE UNKNOW S,,,,T-INTERSECTION,TRAFFIC CONTROL SIGNAL,"TWO-WAY, DIVIDED, UNPROTECTED MEDIAN",DEPARTMENT OF CONSERVATION AND RECREATION,ROADWAY,,YES,AT ADDRESS,231115.97953213,895373.90573893,42.30822914,-71.12259271,2023,D2: NOT DISTRACTED / D3: NOT DISTRACTED,6,MAPC,V1:(NO) / V2:(NO) / V3:(NO),"V1:(YES, VEHICLE OR TRAILER DISABLED) / V2:(YES, VEHICLE OR TRAILER DISABLED) / V3:(NO)",SUFFOLK,,,NO HIT AND RUN,"ROAD SURFACE CONDITION (WET, ICY, SNOW, SLUSH, ETC.)","NO, SCHOOL BUS NOT INVOLVED",25.0,"YES, DEVICE FUNCTIONING",NO,31806.0,2020,0.558,1463,0.155,350,ALL CURBS (DIVIDED HIGHWAY),0,8,0,NO SHOULDER,22,BITUMINOUS CONCRETE ROAD,0,NO SHOULDER,2,2,3,RAISED MEDIAN,LARGE URBANIZED AREA,RURAL OR URBAN PRINCIPAL ARTERIAL,BOSTON (MA-NH-RI),MAINLINE ROADWAY,TWO-WAY TRAFFIC,NO ACCESS CONTROL,35.0,CENTRE STREET,WEST ROXBURY CENTRE STREET ROTARY,MURRAY CIRCLE,BOSTON,FAIR,LEVEL TERRAIN,PULLED BACK FROM HPMS NETWORK ESTIMATION ROUTINE,,0,0,0,PRINCIPAL ARTERIAL - OTHER,2,NO,61.0,"DCC1:NO IMPROPER DRIVING, DCC2:NOT REPORTED",NOT DISTRACTED,MA,NO,NO,,NOT REPORTED,POSSIBLE INJURY (C),COLLISION WITH MOTOR VEHICLE IN TRAFFIC,1,SLOWING OR STOPPED IN TRAFFIC,PASSENGER CAR,"MDA1:CENTER FRONT, MDA2:CENTER REAR",BOSTON,MA,MA,PAN,SEQ1:COLLISION WITH MOTOR VEHICLE IN TRAFFIC,"YES, VEHICLE OR TRAILER DISABLED",NISSAN,,,NORTHBOUND,,CENTRE STREET,2023,1,16,Monday,True
2023,4884982,5204758,BOSTON,01/16/2023,2023-01-16 17:40:00+00:00,OPEN,NON-FATAL INJURY,POSSIBLE INJURY (C),3,1,0,STATE POLICE,REAR-END,V1: TRAVELLING STRAIGHT AHEAD / V2: SLOWING OR STOPPED IN TRAFFIC / V3: SLOWING OR STOPPED IN TRAFFIC,V1: N  / V2: N  / V3: N,V1:(COLLISION WITH MOTOR VEHICLE IN TRAFFIC) V2:(COLLISION WITH MOTOR VEHICLE IN TRAFFIC) V3:(COLLISION WITH MOTOR VEHICLE IN TRAFFIC),DARK - LIGHTED ROADWAY,CLOUDY/RAIN,WET,COLLISION WITH MOTOR VEHICLE IN TRAFFIC,V1:(COLLISION WITH MOTOR VEHICLE IN TRAFFIC) / V2:(COLLISION WITH MOTOR VEHICLE IN TRAFFIC) / V3:(COLLISION WITH MOTOR VEHICLE IN TRAFFIC),D1: (INATTENTION)  / D2: (NO IMPROPER DRIVING)  / D3: (NO IMPROPER DRIVING),V1:(PASSENGER CAR) / V2:(PASSENGER CAR) / V3:(PASSENGER CAR),920,CENTRE STREET RTE UNKNOW S,,,,T-INTERSECTION,TRAFFIC CONTROL SIGNAL,"TWO-WAY, DIVIDED, UNPROTECTED MEDIAN",DEPARTMENT OF CONSERVATION AND RECREATION,ROADWAY,,YES,AT ADDRESS,231115.97953213,895373.90573893,42.30822914,-71.12259271,2023,D2: NOT DISTRACTED / D3: NOT DISTRACTED,6,MAPC,V1:(NO) / V2:(NO) / V3:(NO),"V1:(YES, VEHICLE OR TRAILER DISABLED) / V2:(YES, VEHICLE OR TRAILER DISABLED) / V3:(NO)",SUFFOLK,,,NO HIT AND RUN,"ROAD SURFACE CONDITION (WET, ICY, SNOW, SLUSH, ETC.)","NO, SCHOOL BUS NOT INVOLVED",25.0,"YES, DEVICE FUNCTIONING",NO,31806.0,2020,0.558,1463,0.155,350,ALL CURBS (DIVIDED HIGHWAY),0,8,0,NO SHOULDER,22,BITUMINOUS CONCRETE ROAD,0,NO SHOULDER,2,2,3,RAISED MEDIAN,LARGE URBANIZED AREA,RURAL OR URBAN PRINCIPAL ARTERIAL,BOSTON (MA-NH-RI),MAINLINE ROADWAY,TWO-WAY TRAFFIC,NO ACCESS CONTROL,35.0,CENTRE STREET,WEST ROXBURY CENTRE STREET ROTARY,MURRAY CIRCLE,BOSTON,FAIR,LEVEL TERRAIN,PULLED BACK FROM HPMS NETWORK ESTIMATION ROUTINE,,0,0,0,PRINCIPAL ARTERIAL - OTHER,3,NO,32.0,"DCC1:NO IMPROPER DRIVING, DCC2:NOT REPORTED",NOT DISTRACTED,MA,NO,NO,,NOT REPORTED,NO APPARENT INJURY (O),COLLISION WITH MOTOR VEHICLE IN TRAFFIC,1,SLOWING OR STOPPED IN TRAFFIC,PASSENGER CAR,MDA1:CENTER REAR,COHASSET,MA,MA,PAN,SEQ1:COLLISION WITH MOTOR VEHICLE IN TRAFFIC,NO,INFINITI,,,NORTHBOUND,,CENTRE STREET,2023,1,16,Monday,True
2023,4885679,5205230,BOSTON,01/22/2023,2023-01-22 15:47:00+00:00,OPEN,PROPERTY DAMAGE ONLY (NONE INJURED),NO APPARENT INJURY (O),2,0,0,STATE POLICE,REAR-END,V1: TRAVELLING STRAIGHT AHEAD / V2: SLOWING OR STOPPED IN TRAFFIC,V1: S  / V2: S,V1:(COLLISION WITH MOTOR VEHICLE IN TRAFFIC) V2:(COLLISION WITH MOTOR VEHICLE IN TRAFFIC),DAYLIGHT,CLOUDY/RAIN,WET,COLLISION WITH MOTOR VEHICLE IN TRAFFIC,V1:(COLLISION WITH MOTOR VEHICLE IN TRAFFIC) / V2:(COLLISION WITH MOTOR VEHICLE IN TRAFFIC),D1: (FOLLOWED TOO CLOSELY)  / D2: (NO IMPROPER DRIVING),V1:(PASSENGER CAR) / V2:(PASSENGER CAR),,CENTRE STREET,,MURRAY CIRCLE,,TRAFFIC CIRCLE,NO CONTROLS,"ONE-WAY, NOT DIVIDED",DEPARTMENT OF CONSERVATION AND RECREATION,ROADWAY,,YES,OPERATOR DESIGNATED,231149.56199208,895465.4820286,42.30905224,-71.12218048,2023,D1: NOT DISTRACTED / D2: NOT DISTRACTED,6,MAPC,V1:(NO) / V2:(NO),"V1:(YES, VEHICLE OR TRAILER DISABLED) / V2:(YES, VEHICLE OR TRAILER DISABLED)",SUFFOLK,,,NO HIT AND RUN,"ROAD SURFACE CONDITION (WET, ICY, SNOW, SLUSH, ETC.)","NO, SCHOOL BUS NOT INVOLVED",25.0,NOT REPORTED,NO,33898.0,2009,3,3,2,2,ALL CURBS (DIVIDED HIGHWAY),0,8,0,NO SHOULDER,22,BITUMINOUS CONCRETE ROAD,0,NO SHOULDER,2,2,40,RAISED MEDIAN,LARGE URBANIZED AREA,RURAL OR URBAN PRINCIPAL ARTERIAL,BOSTON (MA-NH-RI),MAINLINE ROADWAY,TWO-WAY TRAFFIC,NO ACCESS CONTROL,25.0,CENTRE STREET,WEST ROXBURY CENTRE STREET ROTARY,MURRAY CIRCLE,BOSTON,FAIR,ROLLING TERRAIN,ESTIMATE,8536,0,0,0,PRINCIPAL ARTERIAL - OTHER,1,NO,60.0,"DCC1:FOLLOWED TOO CLOSELY, DCC2:NOT REPORTED",NOT DISTRACTED,MA,NO,NO,,NOT REPORTED,NO APPARENT INJURY (O),COLLISION WITH MOTOR VEHICLE IN TRAFFIC,1,TRAVELLING STRAIGHT AHEAD,PASSENGER CAR,MDA1:CENTER FRONT,HYDE PARK,MA,MA,PAN,SEQ1:COLLISION WITH MOTOR VEHICLE IN TRAFFIC,"YES, VEHICLE OR TRAILER DISABLED",,,V1: (720 906 B),SOUTHBOUND,,CENTRE STREET,2023,1,22,Sunday,False
2023,4885679,5205230,BOSTON,01/22/2023,2023-01-22 15:47:00+00:00,OPEN,PROPERTY DAMAGE ONLY (NONE INJURED),NO APPARENT INJURY (O),2,0,0,STATE POLICE,REAR-END,V1: TRAVELLING STRAIGHT AHEAD / V2: SLOWING OR STOPPED IN TRAFFIC,V1: S  / V2: S,V1:(COLLISION WITH MOTOR VEHICLE IN TRAFFIC) V2:(COLLISION WITH MOTOR VEHICLE IN TRAFFIC),DAYLIGHT,CLOUDY/RAIN,WET,COLLISION WITH MOTOR VEHICLE IN TRAFFIC,V1:(COLLISION WITH MOTOR VEHICLE IN TRAFFIC) / V2:(COLLISION WITH MOTOR VEHICLE IN TRAFFIC),D1: (FOLLOWED TOO CLOSELY)  / D2: (NO IMPROPER DRIVING),V1:(PASSENGER CAR) / V2:(PASSENGER CAR),,CENTRE STREET,,MURRAY CIRCLE,,TRAFFIC CIRCLE,NO CONTROLS,"ONE-WAY, NOT DIVIDED",DEPARTMENT OF CONSERVATION AND RECREATION,ROADWAY,,YES,OPERATOR DESIGNATED,231149.56199208,895465.4820286,42.30905224,-71.12218048,2023,D1: NOT DISTRACTED / D2: NOT DISTRACTED,6,MAPC,V1:(NO) / V2:(NO),"V1:(YES, VEHICLE OR TRAILER DISABLED) / V2:(YES, VEHICLE OR TRAILER DISABLED)",SUFFOLK,,,NO HIT AND RUN,"ROAD SURFACE CONDITION (WET, ICY, SNOW, SLUSH, ETC.)","NO, SCHOOL BUS NOT INVOLVED",25.0,NOT REPORTED,NO,33898.0,2009,3,3,2,2,ALL CURBS (DIVIDED HIGHWAY),0,8,0,NO SHOULDER,22,BITUMINOUS CONCRETE ROAD,0,NO SHOULDER,2,2,40,RAISED MEDIAN,LARGE URBANIZED AREA,RURAL OR URBAN PRINCIPAL ARTERIAL,BOSTON (MA-NH-RI),MAINLINE ROADWAY,TWO-WAY TRAFFIC,NO ACCESS CONTROL,25.0,CENTRE STREET,WEST ROXBURY CENTRE STREET ROTARY,MURRAY CIRCLE,BOSTON,FAIR,ROLLING TERRAIN,ESTIMATE,8536,0,0,0,PRINCIPAL ARTERIAL - OTHER,2,NO,62.0,"DCC1:NO IMPROPER DRIVING, DCC2:NOT REPORTED",NOT DISTRACTED,MA,NO,NO,,NOT REPORTED,NO APPARENT INJURY (O),COLLISION WITH MOTOR VEHICLE IN TRAFFIC,1,SLOWING OR STOPPED IN TRAFFIC,PASSENGER CAR,"MDA1:CENTER REAR, MDA2:TOTAL (ALL AREAS)",BOSTON,MA,MA,PAN,SEQ1:COLLISION WITH MOTOR VEHICLE IN TRAFFIC,"YES, VEHICLE OR TRAILER DISABLED",HONDA,,V1: (720 906 B),SOUTHBOUND,,CENTRE STREET,2023,1,22,Sunday,False
2023,4885876,5206109,BOSTON,01/19/2023,2023-01-19 15:54:00+00:00,OPEN,PROPERTY DAMAGE ONLY (NONE INJURED),NO APPARENT INJURY (O),2,0,0,STATE POLICE,REAR-END,V1: SLOWING OR STOPPED IN TRAFFIC / V2: TRAVELLING STRAIGHT AHEAD,V1: S  / V2: S,V1:(COLLISION WITH MOTOR VEHICLE IN TRAFFIC) V2:(COLLISION WITH MOTOR VEHICLE IN TRAFFIC),DARK - LIGHTED ROADWAY,CLOUDY/RAIN,WET,COLLISION WITH MOTOR VEHICLE IN TRAFFIC,V1:(COLLISION WITH MOTOR VEHICLE IN TRAFFIC) / V2:(COLLISION WITH MOTOR VEHICLE IN TRAFFIC),D1: (NO IMPROPER DRIVING)  / D2: (FOLLOWED TOO CLOSELY),"V1:(PASSENGER CAR) / V2:(LIGHT TRUCK(VAN, MINI-VAN, PICKUP, SPORT UTILITY))",1125,CENTRE STREET RTE UNKNOW,,,,NOT AT JUNCTION,NO CONTROLS,"TWO-WAY, DIVIDED, POSITIVE MEDIAN BARRIER",DEPARTMENT OF CONSERVATION AND RECREATION,ROADWAY,,YES,AT ADDRESS,230826.43497255,894671.71102551,42.3019189,-71.1261419,2023,D2: NOT DISTRACTED,6,MAPC,V1:(NO) / V2:(NO),V1:(NO) / V2:(NO),SUFFOLK,,,NO HIT AND RUN,,"NO, SCHOOL BUS NOT INVOLVED",35.0,NOT REPORTED,NO,33898.0,2009,3,3,2,2,ALL CURBS (DIVIDED HIGHWAY),0,8,0,NO SHOULDER,22,BITUMINOUS CONCRETE ROAD,0,NO SHOULDER,2,2,3,RAISED MEDIAN,LARGE URBANIZED AREA,RURAL OR URBAN PRINCIPAL ARTERIAL,BOSTON (MA-NH-RI),MAINLINE ROADWAY,TWO-WAY TRAFFIC,NO ACCESS CONTROL,30.0,CENTRE STREET,WEST ROXBURY CENTRE STREET ROTARY,MURRAY CIRCLE,BOSTON,FAIR,ROLLING TERRAIN,ESTIMATE,8536,0,0,0,PRINCIPAL ARTERIAL - OTHER,1,NO,20.0,"DCC1:NO IMPROPER DRIVING, DCC2:NOT REPORTED",NOT REPORTED,MA,NO,NO,,NOT REPORTED,NO APPARENT INJURY (O),COLLISION WITH MOTOR VEHICLE IN TRAFFIC,1,SLOWING OR STOPPED IN TRAFFIC,PASSENGER CAR,"MDA1:RIGHT REAR, MDA2:CENTER REAR",DEDHAM,MA,MA,DLN,SEQ1:COLLISION WITH MOTOR VEHICLE IN TRAFFIC,NO,,,V2:,SOUTHBOUND,,CENTRE STREET,2023,1,19,Thursday,False
2023,4885876,5206109,BOSTON,01/19/2023,2023-01-19 15:54:00+00:00,OPEN,PROPERTY DAMAGE ONLY (NONE INJURED),NO APPARENT INJURY (O),2,0,0,STATE POLICE,REAR-END,V1: SLOWING OR STOPPED IN TRAFFIC / V2: TRAVELLING STRAIGHT AHEAD,V1: S  / V2: S,V1:(COLLISION WITH MOTOR VEHICLE IN TRAFFIC) V2:(COLLISION WITH MOTOR VEHICLE IN TRAFFIC),DARK - LIGHTED ROADWAY,CLOUDY/RAIN,WET,COLLISION WITH MOTOR VEHICLE IN TRAFFIC,V1:(COLLISION WITH MOTOR VEHICLE IN TRAFFIC) / V2:(COLLISION WITH MOTOR VEHICLE IN TRAFFIC),D1: (NO IMPROPER DRIVING)  / D2: (FOLLOWED TOO CLOSELY),"V1:(PASSENGER CAR) / V2:(LIGHT TRUCK(VAN, MINI-VAN, PICKUP, SPORT UTILITY))",1125,CENTRE STREET RTE UNKNOW,,,,NOT AT JUNCTION,NO CONTROLS,"TWO-WAY, DIVIDED, POSITIVE MEDIAN BARRIER",DEPARTMENT OF CONSERVATION AND RECREATION,ROADWAY,,YES,AT ADDRESS,230826.43497255,894671.71102551,42.3019189,-71.1261419,2023,D2: NOT DISTRACTED,6,MAPC,V1:(NO) / V2:(NO),V1:(NO) / V2:(NO),SUFFOLK,,,NO HIT AND RUN,,"NO, SCHOOL BUS NOT INVOLVED",35.0,NOT REPORTED,NO,33898.0,2009,3,3,2,2,ALL CURBS (DIVIDED HIGHWAY),0,8,0,NO SHOULDER,22,BITUMINOUS CONCRETE ROAD,0,NO SHOULDER,2,2,3,RAISED MEDIAN,LARGE URBANIZED AREA,RURAL OR URBAN PRINCIPAL ARTERIAL,BOSTON (MA-NH-RI),MAINLINE ROADWAY,TWO-WAY TRAFFIC,NO ACCESS CONTROL,30.0,CENTRE STREET,WEST ROXBURY CENTRE STREET ROTARY,MURRAY CIRCLE,BOSTON,FAIR,ROLLING TERRAIN,ESTIMATE,8536,0,0,0,PRINCIPAL ARTERIAL - OTHER,2,NO,19.0,"DCC1:FOLLOWED TOO CLOSELY, DCC2:NOT REPORTED",NOT DISTRACTED,MA,NO,NO,,NOT REPORTED,NO APPARENT INJURY (O),COLLISION WITH MOTOR VEHICLE IN TRAFFIC,1,TRAVELLING STRAIGHT AHEAD,"LIGHT TRUCK(VAN, MINI-VAN, PICKUP, SPORT UTILITY)","MDA1:CENTER FRONT, MDA2:RIGHT FRONT",WEST ROXBURY,MA,MA,PAN,SEQ1:COLLISION WITH MOTOR VEHICLE IN TRAFFIC,NO,AUDI,Q5,V2:,SOUTHBOUND,,CENTRE STREET,2023,1,19,Thursday,False
2023,4889243,5209055,BOSTON,01/24/2023,2023-01-24 10:05:00+00:00,OPEN,NON-FATAL INJURY,SUSPECTED MINOR INJURY (B),3,1,0,STATE POLICE,"SIDESWIPE, SAME DIRECTION",V1: CHANGING LANES / V2: TRAVELLING STRAIGHT AHEAD / V3: TRAVELLING STRAIGHT AHEAD,V1: W  / V2: W  / V3: W,V1:(COLLISION WITH MOTOR VEHICLE IN TRAFFIC) V2:(COLLISION WITH MOTOR VEHICLE IN TRAFFIC) V3:(COLLISION WITH MOTOR VEHICLE IN TRAFFIC),DAYLIGHT,CLEAR,DRY,COLLISION WITH MOTOR VEHICLE IN TRAFFIC,V1:(COLLISION WITH MOTOR VEHICLE IN TRAFFIC) / V2:(COLLISION WITH MOTOR VEHICLE IN TRAFFIC) / V3:(COLLISION WITH MOTOR VEHICLE IN TRAFFIC),D1: (FAILED TO YIELD RIGHT OF WAY)  / D2: (NO IMPROPER DRIVING)  / D3: (NO IMPROPER DRIVING),"V1:(PASSENGER CAR) / V2:(LIGHT TRUCK(VAN, MINI-VAN, PICKUP, SPORT UTILITY)) / V3:(BUS (SEATS FOR 9-15 PEOPLE, INCLUDING DRIVER))",,PRINCE STREET / CENTRE STREET / ARBORWAY,,,,NOT AT JUNCTION,TRAFFIC CONTROL SIGNAL,"ONE-WAY, NOT DIVIDED",CITY OR TOWN ACCEPTED ROAD,ROADWAY,,YES,OPERATOR DESIGNATED,231269.38298951,895462.14917058,42.30901745,-71.12072734,2023,D1: NOT DISTRACTED / D2: NOT DISTRACTED / D3: NOT DISTRACTED,6,MAPC,V1:(NO) / V2:(NO) / V3:(NO),"V1:(YES, VEHICLE OR TRAILER DISABLED) / V2:(NO) / V3:(YES, VEHICLE OR TRAILER DISABLED)",SUFFOLK,"V3:(YES, FEDERALLY REPORTABLE)","YES, FEDERALLY REPORTABLE",NO HIT AND RUN,,"NO, SCHOOL BUS NOT INVOLVED",25.0,"YES, DEVICE FUNCTIONING",NO,1154.0,,,,,,BOTH SIDES,4,4,0,NO SHOULDER,25,BITUMINOUS CONCRETE ROAD,0,NO SHOULDER,2,0,0,,LARGE URBANIZED AREA,LOCAL,BOSTON (MA-NH-RI),MAINLINE ROADWAY,ONE-WAY TRAFFIC,NO ACCESS CONTROL,,PRINCE STREET,ARBORWAY,CENTRE STREET,BOSTON,FAIR,LEVEL TERRAIN,,,,0,0,LOCAL,1,NO,20.0,"DCC1:FAILED TO YIELD RIGHT OF WAY, DCC2:NOT REPORTED",NOT DISTRACTED,MA,NO,NO,,NOT REPORTED,NO APPARENT INJURY (O),COLLISION WITH MOTOR VEHICLE IN TRAFFIC,1,CHANGING LANES,PASSENGER CAR,MDA1:CENTER FRONT,DORCHESTER,MA,MA,PAN,SEQ1:COLLISION WITH MOTOR VEHICLE IN TRAFFIC,"YES, VEHICLE OR TRAILER DISABLED",TOYOTA,,,WESTBOUND,,CENTRE STREET,2023,1,24,Tuesday,True
2023,4889243,5209055,BOSTON,01/24/2023,2023-01-24 10:05:00+00:00,OPEN,NON-FATAL INJURY,SUSPECTED MINOR INJURY (B),3,1,0,STATE POLICE,"SIDESWIPE, SAME DIRECTION",V1: CHANGING LANES / V2: TRAVELLING STRAIGHT AHEAD / V3: TRAVELLING STRAIGHT AHEAD,V1: W  / V2: W  / V3: W,V1:(COLLISION WITH MOTOR VEHICLE IN TRAFFIC) V2:(COLLISION WITH MOTOR VEHICLE IN TRAFFIC) V3:(COLLISION WITH MOTOR VEHICLE IN TRAFFIC),DAYLIGHT,CLEAR,DRY,COLLISION WITH MOTOR VEHICLE IN TRAFFIC,V1:(COLLISION WITH MOTOR VEHICLE IN TRAFFIC) / V2:(COLLISION WITH MOTOR VEHICLE IN TRAFFIC) / V3:(COLLISION WITH MOTOR VEHICLE IN TRAFFIC),D1: (FAILED TO YIELD RIGHT OF WAY)  / D2: (NO IMPROPER DRIVING)  / D3: (NO IMPROPER DRIVING),"V1:(PASSENGER CAR) / V2:(LIGHT TRUCK(VAN, MINI-VAN, PICKUP, SPORT UTILITY)) / V3:(BUS (SEATS FOR 9-15 PEOPLE, INCLUDING DRIVER))",,PRINCE STREET / CENTRE STREET / ARBORWAY,,,,NOT AT JUNCTION,TRAFFIC CONTROL SIGNAL,"ONE-WAY, NOT DIVIDED",CITY OR TOWN ACCEPTED ROAD,ROADWAY,,YES,OPERATOR DESIGNATED,231269.38298951,895462.14917058,42.30901745,-71.12072734,2023,D1: NOT DISTRACTED / D2: NOT DISTRACTED / D3: NOT DISTRACTED,6,MAPC,V1:(NO) / V2:(NO) / V3:(NO),"V1:(YES, VEHICLE OR TRAILER DISABLED) / V2:(NO) / V3:(YES, VEHICLE OR TRAILER DISABLED)",SUFFOLK,"V3:(YES, FEDERALLY REPORTABLE)","YES, FEDERALLY REPORTABLE",NO HIT AND RUN,,"NO, SCHOOL BUS NOT INVOLVED",25.0,"YES, DEVICE FUNCTIONING",NO,1154.0,,,,,,BOTH SIDES,4,4,0,NO SHOULDER,25,BITUMINOUS CONCRETE ROAD,0,NO SHOULDER,2,0,0,,LARGE URBANIZED AREA,LOCAL,BOSTON (MA-NH-RI),MAINLINE ROADWAY,ONE-WAY TRAFFIC,NO ACCESS CONTROL,,PRINCE STREET,ARBORWAY,CENTRE STREET,BOSTON,FAIR,LEVEL TERRAIN,,,,0,0,LOCAL,2,NO,26.0,"DCC1:NO IMPROPER DRIVING, DCC2:NOT REPORTED",NOT DISTRACTED,MA,NO,NO,,NOT REPORTED,NO APPARENT INJURY (O),COLLISION WITH MOTOR VEHICLE IN TRAFFIC,1,TRAVELLING STRAIGHT AHEAD,"LIGHT TRUCK(VAN, MINI-VAN, PICKUP, SPORT UTILITY)",MDA1:RIGHT REAR,HANOVER,MA,MA,CON,SEQ1:COLLISION WITH MOTOR VEHICLE IN TRAFFIC,NO,NISS,NV,,WESTBOUND,,CENTRE STREET,2023,1,24,Tuesday,True
2023,4889243,5209055,BOSTON,01/24/2023,2023-01-24 10:05:00+00:00,OPEN,NON-FATAL INJURY,SUSPECTED MINOR INJURY (B),3,1,0,STATE POLICE,"SIDESWIPE, SAME DIRECTION",V1: CHANGING LANES / V2: TRAVELLING STRAIGHT AHEAD / V3: TRAVELLING STRAIGHT AHEAD,V1: W  / V2: W  / V3: W,V1:(COLLISION WITH MOTOR VEHICLE IN TRAFFIC) V2:(COLLISION WITH MOTOR VEHICLE IN TRAFFIC) V3:(COLLISION WITH MOTOR VEHICLE IN TRAFFIC),DAYLIGHT,CLEAR,DRY,COLLISION WITH MOTOR VEHICLE IN TRAFFIC,V1:(COLLISION WITH MOTOR VEHICLE IN TRAFFIC) / V2:(COLLISION WITH MOTOR VEHICLE IN TRAFFIC) / V3:(COLLISION WITH MOTOR VEHICLE IN TRAFFIC),D1: (FAILED TO YIELD RIGHT OF WAY)  / D2: (NO IMPROPER DRIVING)  / D3: (NO IMPROPER DRIVING),"V1:(PASSENGER CAR) / V2:(LIGHT TRUCK(VAN, MINI-VAN, PICKUP, SPORT UTILITY)) / V3:(BUS (SEATS FOR 9-15 PEOPLE, INCLUDING DRIVER))",,PRINCE STREET / CENTRE STREET / ARBORWAY,,,,NOT AT JUNCTION,TRAFFIC CONTROL SIGNAL,"ONE-WAY, NOT DIVIDED",CITY OR TOWN ACCEPTED ROAD,ROADWAY,,YES,OPERATOR DESIGNATED,231269.38298951,895462.14917058,42.30901745,-71.12072734,2023,D1: NOT DISTRACTED / D2: NOT DISTRACTED / D3: NOT DISTRACTED,6,MAPC,V1:(NO) / V2:(NO) / V3:(NO),"V1:(YES, VEHICLE OR TRAILER DISABLED) / V2:(NO) / V3:(YES, VEHICLE OR TRAILER DISABLED)",SUFFOLK,"V3:(YES, FEDERALLY REPORTABLE)","YES, FEDERALLY REPORTABLE",NO HIT AND RUN,,"NO, SCHOOL BUS NOT INVOLVED",25.0,"YES, DEVICE FUNCTIONING",NO,1154.0,,,,,,BOTH SIDES,4,4,0,NO SHOULDER,25,BITUMINOUS CONCRETE ROAD,0,NO SHOULDER,2,0,0,,LARGE URBANIZED AREA,LOCAL,BOSTON (MA-NH-RI),MAINLINE ROADWAY,ONE-WAY TRAFFIC,NO ACCESS CONTROL,,PRINCE STREET,ARBORWAY,CENTRE STREET,BOSTON,FAIR,LEVEL TERRAIN,,,,0,0,LOCAL,3,NO,28.0,"DCC1:NO IMPROPER DRIVING, DCC2:NOT REPORTED",NOT DISTRACTED,MA,NO,NO,"YES, FEDERALLY REPORTABLE",NOT REPORTED,SUSPECTED MINOR INJURY (B),COLLISION WITH MOTOR VEHICLE IN TRAFFIC,1,TRAVELLING STRAIGHT AHEAD,"BUS (SEATS FOR 9-15 PEOPLE, INCLUDING DRIVER)",MDA1:RIGHT SIDE,,MA,MA,,SEQ1:COLLISION WITH MOTOR VEHICLE IN TRAFFIC,"YES, VEHICLE OR TRAILER DISABLED",FORD,,,WESTBOUND,,CENTRE STREET,2023,1,24,Tuesday,True
2023,4891043,5220783,BOSTON,02/01/2023,2023-02-01 15:24:00+00:00,OPEN,PROPERTY DAMAGE ONLY (NONE INJURED),NO APPARENT INJURY (O),2,0,0,STATE POLICE,ANGLE,V1: CHANGING LANES / V2: TRAVELLING STRAIGHT AHEAD,V1: S  / V2: S,V1:(COLLISION WITH MOTOR VEHICLE IN TRAFFIC) V2:(COLLISION WITH MOTOR VEHICLE IN TRAFFIC),DAYLIGHT,CLOUDY,DRY,COLLISION WITH MOTOR VEHICLE IN TRAFFIC,V1:(COLLISION WITH MOTOR VEHICLE IN TRAFFIC) / V2:(COLLISION WITH MOTOR VEHICLE IN TRAFFIC),D1: (INATTENTION)  / D2: (NO IMPROPER DRIVING),V1:(PASSENGER CAR) / V2:(PASSENGER CAR),,CENTRE STREET,,MURRAY CIRCLE,,FIVE-POINT OR MORE,YIELD SIGNS,"ONE-WAY, NOT DIVIDED",DEPARTMENT OF CONSERVATION AND RECREATION,ROADWAY,,YES,OPERATOR DESIGNATED,231143.63947118,895453.90310693,42.30894824,-71.12225293,2023,D1: EXTERNAL DISTRACTION (OUTSIDE THE VEHICLE) / D2: NOT DISTRACTED,6,MAPC,V1:(NO) / V2:(NO),"V1:(YES, VEHICLE OR TRAILER DISABLED) / V2:(YES, VEHICLE OR TRAILER DISABLED)",SUFFOLK,"V1:(NO, NOT FEDERALLY REPORTABLE) / V2:(NO, NOT FEDERALLY REPORTABLE)","NO, NOT FEDERALLY REPORTABLE",NO HIT AND RUN,,"NO, SCHOOL BUS NOT INVOLVED",25.0,"YES, DEVICE FUNCTIONING",NO,33898.0,2009,3,3,2,2,ALL CURBS (DIVIDED HIGHWAY),0,8,0,NO SHOULDER,22,BITUMINOUS CONCRETE ROAD,0,NO SHOULDER,2,2,40,RAISED MEDIAN,LARGE URBANIZED AREA,RURAL OR URBAN PRINCIPAL ARTERIAL,BOSTON (MA-NH-RI),MAINLINE ROADWAY,TWO-WAY TRAFFIC,NO ACCESS CONTROL,25.0,CENTRE STREET,WEST ROXBURY CENTRE STREET ROTARY,MURRAY CIRCLE,BOSTON,FAIR,ROLLING TERRAIN,ESTIMATE,8536,0,0,0,PRINCIPAL ARTERIAL - OTHER,1,NO,45.0,"DCC1:INATTENTION, DCC2:NOT REPORTED",EXTERNAL DISTRACTION (OUTSIDE THE VEHICLE),MA,NO,NO,"NO, NOT FEDERALLY REPORTABLE",NOT REPORTED,NO APPARENT INJURY (O),COLLISION WITH MOTOR VEHICLE IN TRAFFIC,1,CHANGING LANES,PASSENGER CAR,"MDA1:CENTER FRONT, MDA2:LEFT SIDE, MDA3:LEFT FRONT",BROOKLINE,MA,MA,PAN,SEQ1:COLLISION WITH MOTOR VEHICLE IN TRAFFIC,"YES, VEHICLE OR TRAILER DISABLED",KIA,SEDONA,,SOUTHBOUND,,CENTRE STREET,2023,2,1,Wednesday,False
2023,4891043,5220783,BOSTON,02/01/2023,2023-02-01 15:24:00+00:00,OPEN,PROPERTY DAMAGE ONLY (NONE INJURED),NO APPARENT INJURY (O),2,0,0,STATE POLICE,ANGLE,V1: CHANGING LANES / V2: TRAVELLING STRAIGHT AHEAD,V1: S  / V2: S,V1:(COLLISION WITH MOTOR VEHICLE IN TRAFFIC) V2:(COLLISION WITH MOTOR VEHICLE IN TRAFFIC),DAYLIGHT,CLOUDY,DRY,COLLISION WITH MOTOR VEHICLE IN TRAFFIC,V1:(COLLISION WITH MOTOR VEHICLE IN TRAFFIC) / V2:(COLLISION WITH MOTOR VEHICLE IN TRAFFIC),D1: (INATTENTION)  / D2: (NO IMPROPER DRIVING),V1:(PASSENGER CAR) / V2:(PASSENGER CAR),,CENTRE STREET,,MURRAY CIRCLE,,FIVE-POINT OR MORE,YIELD SIGNS,"ONE-WAY, NOT DIVIDED",DEPARTMENT OF CONSERVATION AND RECREATION,ROADWAY,,YES,OPERATOR DESIGNATED,231143.63947118,895453.90310693,42.30894824,-71.12225293,2023,D1: EXTERNAL DISTRACTION (OUTSIDE THE VEHICLE) / D2: NOT DISTRACTED,6,MAPC,V1:(NO) / V2:(NO),"V1:(YES, VEHICLE OR TRAILER DISABLED) / V2:(YES, VEHICLE OR TRAILER DISABLED)",SUFFOLK,"V1:(NO, NOT FEDERALLY REPORTABLE) / V2:(NO, NOT FEDERALLY REPORTABLE)","NO, NOT FEDERALLY REPORTABLE",NO HIT AND RUN,,"NO, SCHOOL BUS NOT INVOLVED",25.0,"YES, DEVICE FUNCTIONING",NO,33898.0,2009,3,3,2,2,ALL CURBS (DIVIDED HIGHWAY),0,8,0,NO SHOULDER,22,BITUMINOUS CONCRETE ROAD,0,NO SHOULDER,2,2,40,RAISED MEDIAN,LARGE URBANIZED AREA,RURAL OR URBAN PRINCIPAL ARTERIAL,BOSTON (MA-NH-RI),MAINLINE ROADWAY,TWO-WAY TRAFFIC,NO ACCESS CONTROL,25.0,CENTRE STREET,WEST ROXBURY CENTRE STREET ROTARY,MURRAY CIRCLE,BOSTON,FAIR,ROLLING TERRAIN,ESTIMATE,8536,0,0,0,PRINCIPAL ARTERIAL - OTHER,2,NO,34.0,"DCC1:NO IMPROPER DRIVING, DCC2:NOT REPORTED",NOT DISTRACTED,MA,NO,NO,"NO, NOT FEDERALLY REPORTABLE",NOT REPORTED,NO APPARENT INJURY (O),COLLISION WITH MOTOR VEHICLE IN TRAFFIC,1,TRAVELLING STRAIGHT AHEAD,PASSENGER CAR,"MDA1:RIGHT FRONT, MDA2:RIGHT SIDE",DORCHESTER CENTER,MA,MA,PAN,SEQ1:COLLISION WITH MOTOR VEHICLE IN TRAFFIC,"YES, VEHICLE OR TRAILER DISABLED",BUIC,ENCLAVE,,SOUTHBOUND,,CENTRE STREET,2023,2,1,Wednesday,False
2023,4896059,5225771,BOSTON,01/26/2023,2023-01-26 23:30:00+00:00,OPEN,NON-FATAL INJURY,POSSIBLE INJURY (C),2,1,0,STATE POLICE,REAR-END,V1: TRAVELLING STRAIGHT AHEAD / V2: ENTERING TRAFFIC LANE,V1: N  / V2: N,V1:(COLLISION WITH MOTOR VEHICLE IN TRAFFIC) V2:(COLLISION WITH MOTOR VEHICLE IN TRAFFIC),DARK - LIGHTED ROADWAY,CLEAR,DRY,COLLISION WITH MOTOR VEHICLE IN TRAFFIC,V1:(COLLISION WITH MOTOR VEHICLE IN TRAFFIC) / V2:(COLLISION WITH MOTOR VEHICLE IN TRAFFIC),D2: (NO IMPROPER DRIVING),V1:(PASSENGER CAR) / V2:(PASSENGER CAR),,PRINCE STREET / ARBORWAY / CENTRE STREET,,,,TRAFFIC CIRCLE,NO CONTROLS,"TWO-WAY, NOT DIVIDED",CITY OR TOWN ACCEPTED ROAD,ROADWAY,,YES,OPERATOR DESIGNATED,231269.38298951,895462.14917058,42.30901745,-71.12072734,2023,D2: NOT DISTRACTED,6,MAPC,V1:(NO) / V2:(NO),"V1:(YES, OTHER REASON NOT DISABLED) / V2:(YES, OTHER REASON NOT DISABLED)",SUFFOLK,"V1:(NO, NOT FEDERALLY REPORTABLE) / V2:(NO, NOT FEDERALLY REPORTABLE)","NO, NOT FEDERALLY REPORTABLE","YES, HIT AND RUN",,"NO, SCHOOL BUS NOT INVOLVED",30.0,NOT REPORTED,NO,1154.0,,,,,,BOTH SIDES,4,4,0,NO SHOULDER,25,BITUMINOUS CONCRETE ROAD,0,NO SHOULDER,2,0,0,,LARGE URBANIZED AREA,LOCAL,BOSTON (MA-NH-RI),MAINLINE ROADWAY,ONE-WAY TRAFFIC,NO ACCESS CONTROL,,PRINCE STREET,ARBORWAY,CENTRE STREET,BOSTON,FAIR,LEVEL TERRAIN,,,,0,0,LOCAL,1,NOT REPORTED,,DCC1:NOT REPORTED,NOT REPORTED,MA,NOT REPORTED,NO,"NO, NOT FEDERALLY REPORTABLE",NOT REPORTED,NOT REPORTED,COLLISION WITH MOTOR VEHICLE IN TRAFFIC,1,TRAVELLING STRAIGHT AHEAD,PASSENGER CAR,MDA1:CENTER FRONT,NORTH EGREMONT,MA,MA,PAN,SEQ1:COLLISION WITH MOTOR VEHICLE IN TRAFFIC,"YES, OTHER REASON NOT DISABLED",HOND,CIVIC,,NORTHBOUND,,CENTRE STREET,2023,1,26,Thursday,True
2023,4896059,5225771,BOSTON,01/26/2023,2023-01-26 23:30:00+00:00,OPEN,NON-FATAL INJURY,POSSIBLE INJURY (C),2,1,0,STATE POLICE,REAR-END,V1: TRAVELLING STRAIGHT AHEAD / V2: ENTERING TRAFFIC LANE,V1: N  / V2: N,V1:(COLLISION WITH MOTOR VEHICLE IN TRAFFIC) V2:(COLLISION WITH MOTOR VEHICLE IN TRAFFIC),DARK - LIGHTED ROADWAY,CLEAR,DRY,COLLISION WITH MOTOR VEHICLE IN TRAFFIC,V1:(COLLISION WITH MOTOR VEHICLE IN TRAFFIC) / V2:(COLLISION WITH MOTOR VEHICLE IN TRAFFIC),D2: (NO IMPROPER DRIVING),V1:(PASSENGER CAR) / V2:(PASSENGER CAR),,PRINCE STREET / ARBORWAY / CENTRE STREET,,,,TRAFFIC CIRCLE,NO CONTROLS,"TWO-WAY, NOT DIVIDED",CITY OR TOWN ACCEPTED ROAD,ROADWAY,,YES,OPERATOR DESIGNATED,231269.38298951,895462.14917058,42.30901745,-71.12072734,2023,D2: NOT DISTRACTED,6,MAPC,V1:(NO) / V2:(NO),"V1:(YES, OTHER REASON NOT DISABLED) / V2:(YES, OTHER REASON NOT DISABLED)",SUFFOLK,"V1:(NO, NOT FEDERALLY REPORTABLE) / V2:(NO, NOT FEDERALLY REPORTABLE)","NO, NOT FEDERALLY REPORTABLE","YES, HIT AND RUN",,"NO, SCHOOL BUS NOT INVOLVED",30.0,NOT REPORTED,NO,1154.0,,,,,,BOTH SIDES,4,4,0,NO SHOULDER,25,BITUMINOUS CONCRETE ROAD,0,NO SHOULDER,2,0,0,,LARGE URBANIZED AREA,LOCAL,BOSTON (MA-NH-RI),MAINLINE ROADWAY,ONE-WAY TRAFFIC,NO ACCESS CONTROL,,PRINCE STREET,ARBORWAY,CENTRE STREET,BOSTON,FAIR,LEVEL TERRAIN,,,,0,0,LOCAL,2,NO,35.0,"DCC1:NO IMPROPER DRIVING, DCC2:NOT REPORTED",NOT DISTRACTED,MA,NO,NO,"NO, NOT FEDERALLY REPORTABLE",NOT REPORTED,POSSIBLE INJURY (C),COLLISION WITH MOTOR VEHICLE IN TRAFFIC,2,ENTERING TRAFFIC LANE,PASSENGER CAR,MDA1:CENTER REAR,BOSTON,MA,MA,PAN,SEQ1:COLLISION WITH MOTOR VEHICLE IN TRAFFIC,"YES, OTHER REASON NOT DISABLED",TOYT,CAMRY,,NORTHBOUND,,CENTRE STREET,2023,1,26,Thursday,True
2023,4896076,5225754,BOSTON,02/14/2023,2023-02-14 22:03:00+00:00,OPEN,NON-FATAL INJURY,POSSIBLE INJURY (C),2,3,0,STATE POLICE,ANGLE,V1: TRAVELLING STRAIGHT AHEAD / V2: TRAVELLING STRAIGHT AHEAD,V1: N  / V2: N,V1:(COLLISION WITH MOTOR VEHICLE IN TRAFFIC) V2:(COLLISION WITH MOTOR VEHICLE IN TRAFFIC),DARK - LIGHTED ROADWAY,CLOUDY,DRY,COLLISION WITH MOTOR VEHICLE IN TRAFFIC,V1:(COLLISION WITH MOTOR VEHICLE IN TRAFFIC) / V2:(COLLISION WITH OTHER MOVABLE OBJECT),D1: (NO IMPROPER DRIVING)  / D2: (FAILED TO YIELD RIGHT OF WAY),V1:(PASSENGER CAR) / V2:(PASSENGER CAR),1200,CENTRE STREET RTE UNKNOW N,,,,Y-INTERSECTION,YIELD SIGNS,"TWO-WAY, DIVIDED, UNPROTECTED MEDIAN",DEPARTMENT OF CONSERVATION AND RECREATION,ROADWAY,,YES,AT ADDRESS,230390.35385422,894165.70499417,42.29738051,-71.13145707,2023,D1: NOT DISTRACTED / D2: NOT DISTRACTED,6,MAPC,V1:(NO) / V2:(NO),"V1:(YES, VEHICLE OR TRAILER DISABLED) / V2:(YES, VEHICLE OR TRAILER DISABLED)",SUFFOLK,"V1:(NO, NOT FEDERALLY REPORTABLE) / V2:(NO, NOT FEDERALLY REPORTABLE)","NO, NOT FEDERALLY REPORTABLE",NO HIT AND RUN,,"NO, SCHOOL BUS NOT INVOLVED",25.0,"YES, DEVICE FUNCTIONING",NO,31806.0,2020,0.558,1463,0.155,350,ALL CURBS (DIVIDED HIGHWAY),0,8,0,NO SHOULDER,22,BITUMINOUS CONCRETE ROAD,0,NO SHOULDER,2,2,3,RAISED MEDIAN,LARGE URBANIZED AREA,RURAL OR URBAN PRINCIPAL ARTERIAL,BOSTON (MA-NH-RI),MAINLINE ROADWAY,TWO-WAY TRAFFIC,NO ACCESS CONTROL,35.0,CENTRE STREET,WEST ROXBURY CENTRE STREET ROTARY,MURRAY CIRCLE,BOSTON,FAIR,LEVEL TERRAIN,PULLED BACK FROM HPMS NETWORK ESTIMATION ROUTINE,,0,0,0,PRINCIPAL ARTERIAL - OTHER,1,NO,22.0,"DCC1:NO IMPROPER DRIVING, DCC2:NOT REPORTED",NOT DISTRACTED,NJ,NO,NO,"NO, NOT FEDERALLY REPORTABLE",NOT REPORTED,POSSIBLE INJURY (C),COLLISION WITH MOTOR VEHICLE IN TRAFFIC,2,TRAVELLING STRAIGHT AHEAD,PASSENGER CAR,"MDA1:CENTER FRONT, MDA2:RIGHT FRONT, MDA3:RIGHT SIDE",ELIZABETH,NJ,NJ,PAN,SEQ1:COLLISION WITH MOTOR VEHICLE IN TRAFFIC,"YES, VEHICLE OR TRAILER DISABLED",HONDA,,,NORTHBOUND,,CENTRE STREET,2023,2,14,Tuesday,True
2023,4896076,5225754,BOSTON,02/14/2023,2023-02-14 22:03:00+00:00,OPEN,NON-FATAL INJURY,POSSIBLE INJURY (C),2,3,0,STATE POLICE,ANGLE,V1: TRAVELLING STRAIGHT AHEAD / V2: TRAVELLING STRAIGHT AHEAD,V1: N  / V2: N,V1:(COLLISION WITH MOTOR VEHICLE IN TRAFFIC) V2:(COLLISION WITH MOTOR VEHICLE IN TRAFFIC),DARK - LIGHTED ROADWAY,CLOUDY,DRY,COLLISION WITH MOTOR VEHICLE IN TRAFFIC,V1:(COLLISION WITH MOTOR VEHICLE IN TRAFFIC) / V2:(COLLISION WITH OTHER MOVABLE OBJECT),D1: (NO IMPROPER DRIVING)  / D2: (FAILED TO YIELD RIGHT OF WAY),V1:(PASSENGER CAR) / V2:(PASSENGER CAR),1200,CENTRE STREET RTE UNKNOW N,,,,Y-INTERSECTION,YIELD SIGNS,"TWO-WAY, DIVIDED, UNPROTECTED MEDIAN",DEPARTMENT OF CONSERVATION AND RECREATION,ROADWAY,,YES,AT ADDRESS,230390.35385422,894165.70499417,42.29738051,-71.13145707,2023,D1: NOT DISTRACTED / D2: NOT DISTRACTED,6,MAPC,V1:(NO) / V2:(NO),"V1:(YES, VEHICLE OR TRAILER DISABLED) / V2:(YES, VEHICLE OR TRAILER DISABLED)",SUFFOLK,"V1:(NO, NOT FEDERALLY REPORTABLE) / V2:(NO, NOT FEDERALLY REPORTABLE)","NO, NOT FEDERALLY REPORTABLE",NO HIT AND RUN,,"NO, SCHOOL BUS NOT INVOLVED",25.0,"YES, DEVICE FUNCTIONING",NO,31806.0,2020,0.558,1463,0.155,350,ALL CURBS (DIVIDED HIGHWAY),0,8,0,NO SHOULDER,22,BITUMINOUS CONCRETE ROAD,0,NO SHOULDER,2,2,3,RAISED MEDIAN,LARGE URBANIZED AREA,RURAL OR URBAN PRINCIPAL ARTERIAL,BOSTON (MA-NH-RI),MAINLINE ROADWAY,TWO-WAY TRAFFIC,NO ACCESS CONTROL,35.0,CENTRE STREET,WEST ROXBURY CENTRE STREET ROTARY,MURRAY CIRCLE,BOSTON,FAIR,LEVEL TERRAIN,PULLED BACK FROM HPMS NETWORK ESTIMATION ROUTINE,,0,0,0,PRINCIPAL ARTERIAL - OTHER,2,NO,22.0,"DCC1:FAILED TO YIELD RIGHT OF WAY, DCC2:NOT REPORTED",NOT DISTRACTED,MA,NO,NO,"NO, NOT FEDERALLY REPORTABLE",NOT REPORTED,POSSIBLE INJURY (C),COLLISION WITH OTHER MOVABLE OBJECT,1,TRAVELLING STRAIGHT AHEAD,PASSENGER CAR,"MDA1:CENTER FRONT, MDA2:LEFT SIDE, MDA3:LEFT FRONT",LOWELL,MA,MA,PAN,SEQ1:COLLISION WITH MOTOR VEHICLE IN TRAFFIC,"YES, VEHICLE OR TRAILER DISABLED",HOND,PILOT,,NORTHBOUND,,CENTRE STREET,2023,2,14,Tuesday,True
2023,4896943,5226890,BOSTON,02/17/2023,2023-02-17 08:30:00+00:00,OPEN,PROPERTY DAMAGE ONLY (NONE INJURED),NO APPARENT INJURY (O),1,0,0,STATE POLICE,SINGLE VEHICLE CRASH,V1: TRAVELLING STRAIGHT AHEAD,V1: S,"V1:(COLLISION WITH MOTOR VEHICLE IN TRAFFIC),(RAN OFF ROAD RIGHT),(COLLISION WITH LIGHT  POLE OR OTHER POST/SUPPORT)",DAYLIGHT,CLOUDY,DRY,COLLISION WITH OTHER LIGHT POLE OR OTHER POST/SUPPORT,V1:(COLLISION WITH LIGHT POLE OR OTHER POST/SUPPORT),D1: (OPERATING DEFECTIVE EQUIPMENT),V1:(PASSENGER CAR),1146,CENTRE STREET RTE UNKNOW,,,,NOT AT JUNCTION,FLASHING TRAFFIC CONTROL SIGNAL,"TWO-WAY, DIVIDED, POSITIVE MEDIAN BARRIER",DEPARTMENT OF CONSERVATION AND RECREATION,ROADWAY,,YES,AT ADDRESS,230730.89386687,894525.22661718,42.30060389,-71.12730836,2023,D1: NOT DISTRACTED,6,MAPC,V1:(NO),"V1:(YES, VEHICLE OR TRAILER DISABLED)",SUFFOLK,"V1:(NO, NOT FEDERALLY REPORTABLE)","NO, NOT FEDERALLY REPORTABLE",NO HIT AND RUN,,"NO, SCHOOL BUS NOT INVOLVED",35.0,"YES, DEVICE FUNCTIONING",NO,31806.0,2020,0.558,1463,0.155,350,ALL CURBS (DIVIDED HIGHWAY),0,8,0,NO SHOULDER,22,BITUMINOUS CONCRETE ROAD,0,NO SHOULDER,2,2,3,RAISED MEDIAN,LARGE URBANIZED AREA,RURAL OR URBAN PRINCIPAL ARTERIAL,BOSTON (MA-NH-RI),MAINLINE ROADWAY,TWO-WAY TRAFFIC,NO ACCESS CONTROL,35.0,CENTRE STREET,WEST ROXBURY CENTRE STREET ROTARY,MURRAY CIRCLE,BOSTON,FAIR,LEVEL TERRAIN,PULLED BACK FROM HPMS NETWORK ESTIMATION ROUTINE,,0,0,0,PRINCIPAL ARTERIAL - OTHER,1,NO,56.0,"DCC1:OPERATING DEFECTIVE EQUIPMENT, DCC2:NOT REPORTED",NOT DISTRACTED,MA,NO,NO,"NO, NOT FEDERALLY REPORTABLE",NOT REPORTED,NO APPARENT INJURY (O),COLLISION WITH LIGHT POLE OR OTHER POST/SUPPORT,1,TRAVELLING STRAIGHT AHEAD,PASSENGER CAR,"MDA1:CENTER FRONT, MDA2:RIGHT FRONT, MDA3:LEFT FRONT",MATTAPAN,MA,MA,PAN,"SEQ1:COLLISION WITH MOTOR VEHICLE IN TRAFFIC, SEQ2:RAN OFF ROAD RIGHT,SEQ3:COLLISION WITH LIGHT  POLE OR OTHER POST/SUPPORT","YES, VEHICLE OR TRAILER DISABLED",INFI,I35,,SOUTHBOUND,,CENTRE STREET,2023,2,17,Friday,False
2023,4900769,5230811,BOSTON,02/26/2023,2023-02-26 23:20:00+00:00,OPEN,PROPERTY DAMAGE ONLY (NONE INJURED),NO APPARENT INJURY (O),2,0,0,STATE POLICE,"SIDESWIPE, SAME DIRECTION",V1: TURNING LEFT / V2: TURNING LEFT,V1: N  / V2: N,V1:(COLLISION WITH MOTOR VEHICLE IN TRAFFIC) V2:(COLLISION WITH MOTOR VEHICLE IN TRAFFIC),DARK - LIGHTED ROADWAY,CLEAR,DRY,COLLISION WITH MOTOR VEHICLE IN TRAFFIC,V1:(COLLISION WITH MOTOR VEHICLE IN TRAFFIC) / V2:(COLLISION WITH MOTOR VEHICLE IN TRAFFIC),D1: (FOLLOWED TOO CLOSELY)  / D2: (FOLLOWED TOO CLOSELY),"V1:(LIGHT TRUCK(VAN, MINI-VAN, PICKUP, SPORT UTILITY)) / V2:(LIGHT TRUCK(VAN, MINI-VAN, PICKUP, SPORT UTILITY))",,PRINCE STREET / ARBORWAY / CENTRE STREET,,,,TRAFFIC CIRCLE,NO CONTROLS,"ONE-WAY, NOT DIVIDED",CITY OR TOWN ACCEPTED ROAD,ROADWAY,,YES,OPERATOR DESIGNATED,231269.38298951,895462.14917058,42.30901745,-71.12072734,2023,D1: NOT DISTRACTED / D2: NOT DISTRACTED,6,MAPC,V1:(NO) / V2:(NO),"V1:(YES, OTHER REASON NOT DISABLED) / V2:(YES, OTHER REASON NOT DISABLED)",SUFFOLK,"V1:(NO, NOT FEDERALLY REPORTABLE) / V2:(NO, NOT FEDERALLY REPORTABLE)","NO, NOT FEDERALLY REPORTABLE",NO HIT AND RUN,,"NO, SCHOOL BUS NOT INVOLVED",25.0,NOT REPORTED,NO,1154.0,,,,,,BOTH SIDES,4,4,0,NO SHOULDER,25,BITUMINOUS CONCRETE ROAD,0,NO SHOULDER,2,0,0,,LARGE URBANIZED AREA,LOCAL,BOSTON (MA-NH-RI),MAINLINE ROADWAY,ONE-WAY TRAFFIC,NO ACCESS CONTROL,,PRINCE STREET,ARBORWAY,CENTRE STREET,BOSTON,FAIR,LEVEL TERRAIN,,,,0,0,LOCAL,1,NO,29.0,"DCC1:FOLLOWED TOO CLOSELY, DCC2:NOT REPORTED",NOT DISTRACTED,MA,NO,NO,"NO, NOT FEDERALLY REPORTABLE",NOT REPORTED,NO APPARENT INJURY (O),COLLISION WITH MOTOR VEHICLE IN TRAFFIC,1,TURNING LEFT,"LIGHT TRUCK(VAN, MINI-VAN, PICKUP, SPORT UTILITY)",MDA1:RIGHT SIDE,HYDE PARK,MA,MA,PAN,SEQ1:COLLISION WITH MOTOR VEHICLE IN TRAFFIC,"YES, OTHER REASON NOT DISABLED",JEEP,GRAND,,NORTHBOUND,,CENTRE STREET,2023,2,26,Sunday,False
2023,4900769,5230811,BOSTON,02/26/2023,2023-02-26 23:20:00+00:00,OPEN,PROPERTY DAMAGE ONLY (NONE INJURED),NO APPARENT INJURY (O),2,0,0,STATE POLICE,"SIDESWIPE, SAME DIRECTION",V1: TURNING LEFT / V2: TURNING LEFT,V1: N  / V2: N,V1:(COLLISION WITH MOTOR VEHICLE IN TRAFFIC) V2:(COLLISION WITH MOTOR VEHICLE IN TRAFFIC),DARK - LIGHTED ROADWAY,CLEAR,DRY,COLLISION WITH MOTOR VEHICLE IN TRAFFIC,V1:(COLLISION WITH MOTOR VEHICLE IN TRAFFIC) / V2:(COLLISION WITH MOTOR VEHICLE IN TRAFFIC),D1: (FOLLOWED TOO CLOSELY)  / D2: (FOLLOWED TOO CLOSELY),"V1:(LIGHT TRUCK(VAN, MINI-VAN, PICKUP, SPORT UTILITY)) / V2:(LIGHT TRUCK(VAN, MINI-VAN, PICKUP, SPORT UTILITY))",,PRINCE STREET / ARBORWAY / CENTRE STREET,,,,TRAFFIC CIRCLE,NO CONTROLS,"ONE-WAY, NOT DIVIDED",CITY OR TOWN ACCEPTED ROAD,ROADWAY,,YES,OPERATOR DESIGNATED,231269.38298951,895462.14917058,42.30901745,-71.12072734,2023,D1: NOT DISTRACTED / D2: NOT DISTRACTED,6,MAPC,V1:(NO) / V2:(NO),"V1:(YES, OTHER REASON NOT DISABLED) / V2:(YES, OTHER REASON NOT DISABLED)",SUFFOLK,"V1:(NO, NOT FEDERALLY REPORTABLE) / V2:(NO, NOT FEDERALLY REPORTABLE)","NO, NOT FEDERALLY REPORTABLE",NO HIT AND RUN,,"NO, SCHOOL BUS NOT INVOLVED",25.0,NOT REPORTED,NO,1154.0,,,,,,BOTH SIDES,4,4,0,NO SHOULDER,25,BITUMINOUS CONCRETE ROAD,0,NO SHOULDER,2,0,0,,LARGE URBANIZED AREA,LOCAL,BOSTON (MA-NH-RI),MAINLINE ROADWAY,ONE-WAY TRAFFIC,NO ACCESS CONTROL,,PRINCE STREET,ARBORWAY,CENTRE STREET,BOSTON,FAIR,LEVEL TERRAIN,,,,0,0,LOCAL,2,NO,26.0,"DCC1:FOLLOWED TOO CLOSELY, DCC2:NOT REPORTED",NOT DISTRACTED,MA,NO,NO,"NO, NOT FEDERALLY REPORTABLE",NOT REPORTED,NO APPARENT INJURY (O),COLLISION WITH MOTOR VEHICLE IN TRAFFIC,1,TURNING LEFT,"LIGHT TRUCK(VAN, MINI-VAN, PICKUP, SPORT UTILITY)",MDA1:LEFT SIDE,,MA,MA,AMN,SEQ1:COLLISION WITH MOTOR VEHICLE IN TRAFFIC,"YES, OTHER REASON NOT DISABLED",FORD,,,NORTHBOUND,,CENTRE STREET,2023,2,26,Sunday,False
2023,4900863,5230717,BOSTON,02/27/2023,2023-02-27 08:00:00+00:00,OPEN,PROPERTY DAMAGE ONLY (NONE INJURED),NO APPARENT INJURY (O),2,0,0,STATE POLICE,"SIDESWIPE, SAME DIRECTION",V1: TRAVELLING STRAIGHT AHEAD / V2: SLOWING OR STOPPED IN TRAFFIC,V1: N  / V2: N,V1:(COLLISION WITH MOTOR VEHICLE IN TRAFFIC) V2:(COLLISION WITH MOTOR VEHICLE IN TRAFFIC),DAYLIGHT,CLEAR/SNOW,ICE,COLLISION WITH MOTOR VEHICLE IN TRAFFIC,,D1: (FOLLOWED TOO CLOSELY)  / D2: (OTHER IMPROPER ACTION),"V1:(LIGHT TRUCK(VAN, MINI-VAN, PICKUP, SPORT UTILITY)) / V2:(PASSENGER CAR)",,CENTRE STREET RTE N  / WESTCHESTER ROAD RTE,,,,NOT AT JUNCTION,NO CONTROLS,"TWO-WAY, DIVIDED, POSITIVE MEDIAN BARRIER",DEPARTMENT OF CONSERVATION AND RECREATION,ROADWAY,,YES,AT INTERSECTION,230895.7634,894773.3532,42.30283122,-71.12529569,2023,D1: NOT DISTRACTED / D2: NOT DISTRACTED,6,MAPC,V1:(NO) / V2:(NO),"V1:(YES, VEHICLE OR TRAILER DISABLED) / V2:(YES, VEHICLE OR TRAILER DISABLED)",SUFFOLK,"V1:(NO, NOT FEDERALLY REPORTABLE) / V2:(NO, NOT FEDERALLY REPORTABLE)","NO, NOT FEDERALLY REPORTABLE",NO HIT AND RUN,"ROAD SURFACE CONDITION (WET, ICY, SNOW, SLUSH, ETC.)","NO, SCHOOL BUS NOT INVOLVED",25.0,NOT REPORTED,NO,31806.0,2020,0.558,1463,0.155,350,ALL CURBS (DIVIDED HIGHWAY),0,8,0,NO SHOULDER,22,BITUMINOUS CONCRETE ROAD,0,NO SHOULDER,2,2,3,RAISED MEDIAN,LARGE URBANIZED AREA,RURAL OR URBAN PRINCIPAL ARTERIAL,BOSTON (MA-NH-RI),MAINLINE ROADWAY,TWO-WAY TRAFFIC,NO ACCESS CONTROL,35.0,CENTRE STREET,WEST ROXBURY CENTRE STREET ROTARY,MURRAY CIRCLE,BOSTON,FAIR,ROLLING TERRAIN,PULLED BACK FROM HPMS NETWORK ESTIMATION ROUTINE,,0,0,0,PRINCIPAL ARTERIAL - OTHER,1,NO,52.0,"DCC1:FOLLOWED TOO CLOSELY, DCC2:NOT REPORTED",NOT DISTRACTED,MA,NO,NO,"NO, NOT FEDERALLY REPORTABLE",NOT REPORTED,NO APPARENT INJURY (O),NOT REPORTED,1,TRAVELLING STRAIGHT AHEAD,"LIGHT TRUCK(VAN, MINI-VAN, PICKUP, SPORT UTILITY)","MDA1:CENTER FRONT, MDA2:RIGHT FRONT, MDA3:LEFT FRONT",WEST ROXBURY,MA,MA,PAN,SEQ1:COLLISION WITH MOTOR VEHICLE IN TRAFFIC,"YES, VEHICLE OR TRAILER DISABLED",TOYT,TACOMA,,NORTHBOUND,,CENTRE STREET,2023,2,27,Monday,False
2023,4900863,5230717,BOSTON,02/27/2023,2023-02-27 08:00:00+00:00,OPEN,PROPERTY DAMAGE ONLY (NONE INJURED),NO APPARENT INJURY (O),2,0,0,STATE POLICE,"SIDESWIPE, SAME DIRECTION",V1: TRAVELLING STRAIGHT AHEAD / V2: SLOWING OR STOPPED IN TRAFFIC,V1: N  / V2: N,V1:(COLLISION WITH MOTOR VEHICLE IN TRAFFIC) V2:(COLLISION WITH MOTOR VEHICLE IN TRAFFIC),DAYLIGHT,CLEAR/SNOW,ICE,COLLISION WITH MOTOR VEHICLE IN TRAFFIC,,D1: (FOLLOWED TOO CLOSELY)  / D2: (OTHER IMPROPER ACTION),"V1:(LIGHT TRUCK(VAN, MINI-VAN, PICKUP, SPORT UTILITY)) / V2:(PASSENGER CAR)",,CENTRE STREET RTE N  / WESTCHESTER ROAD RTE,,,,NOT AT JUNCTION,NO CONTROLS,"TWO-WAY, DIVIDED, POSITIVE MEDIAN BARRIER",DEPARTMENT OF CONSERVATION AND RECREATION,ROADWAY,,YES,AT INTERSECTION,230895.7634,894773.3532,42.30283122,-71.12529569,2023,D1: NOT DISTRACTED / D2: NOT DISTRACTED,6,MAPC,V1:(NO) / V2:(NO),"V1:(YES, VEHICLE OR TRAILER DISABLED) / V2:(YES, VEHICLE OR TRAILER DISABLED)",SUFFOLK,"V1:(NO, NOT FEDERALLY REPORTABLE) / V2:(NO, NOT FEDERALLY REPORTABLE)","NO, NOT FEDERALLY REPORTABLE",NO HIT AND RUN,"ROAD SURFACE CONDITION (WET, ICY, SNOW, SLUSH, ETC.)","NO, SCHOOL BUS NOT INVOLVED",25.0,NOT REPORTED,NO,31806.0,2020,0.558,1463,0.155,350,ALL CURBS (DIVIDED HIGHWAY),0,8,0,NO SHOULDER,22,BITUMINOUS CONCRETE ROAD,0,NO SHOULDER,2,2,3,RAISED MEDIAN,LARGE URBANIZED AREA,RURAL OR URBAN PRINCIPAL ARTERIAL,BOSTON (MA-NH-RI),MAINLINE ROADWAY,TWO-WAY TRAFFIC,NO ACCESS CONTROL,35.0,CENTRE STREET,WEST ROXBURY CENTRE STREET ROTARY,MURRAY CIRCLE,BOSTON,FAIR,ROLLING TERRAIN,PULLED BACK FROM HPMS NETWORK ESTIMATION ROUTINE,,0,0,0,PRINCIPAL ARTERIAL - OTHER,2,NO,50.0,"DCC1:OTHER IMPROPER ACTION, DCC2:NOT REPORTED",NOT DISTRACTED,MA,NO,NO,"NO, NOT FEDERALLY REPORTABLE",NOT REPORTED,NO APPARENT INJURY (O),NOT REPORTED,1,SLOWING OR STOPPED IN TRAFFIC,PASSENGER CAR,"MDA1:LEFT REAR, MDA2:LEFT SIDE",BOSTON,MA,MA,PAN,SEQ1:COLLISION WITH MOTOR VEHICLE IN TRAFFIC,"YES, VEHICLE OR TRAILER DISABLED",BMW,X2,,NORTHBOUND,,CENTRE STREET,2023,2,27,Monday,False
2023,4901070,5230509,BOSTON,02/05/2023,2023-02-05 01:00:00+00:00,OPEN,PROPERTY DAMAGE ONLY (NONE INJURED),NO APPARENT INJURY (O),2,0,0,STATE POLICE,HEAD-ON,V1: TRAVELLING STRAIGHT AHEAD / V2: TRAVELLING STRAIGHT AHEAD,V1: N  / V2: S,V1:(COLLISION WITH MOTOR VEHICLE IN TRAFFIC) V2:(COLLISION WITH MOTOR VEHICLE IN TRAFFIC),DARK - LIGHTED ROADWAY,CLEAR,DRY,COLLISION WITH MOTOR VEHICLE IN TRAFFIC,V1:(COLLISION WITH MOTOR VEHICLE IN TRAFFIC) / V2:(COLLISION WITH MOTOR VEHICLE IN TRAFFIC),"D1: (NO IMPROPER DRIVING)  / D2: (DISREGARDED TRAFFIC SIGNS, SIGNALS, ROAD MARKINGS)","V1:(LIGHT TRUCK(VAN, MINI-VAN, PICKUP, SPORT UTILITY)) / V2:(PASSENGER CAR)",,CENTRE STREET,,ARBORWAY,,TRAFFIC CIRCLE,YIELD SIGNS,"ONE-WAY, NOT DIVIDED",DEPARTMENT OF CONSERVATION AND RECREATION,ROADWAY,,YES,OPERATOR DESIGNATED,231216.95479983,895485.56508913,42.30923035,-71.12136198,2023,D1: NOT DISTRACTED / D2: TALKING ON HAND-HELD ELECTRONIC DEVICE,6,MAPC,V1:(NO) / V2:(NO),"V1:(YES, VEHICLE OR TRAILER DISABLED) / V2:(YES, VEHICLE OR TRAILER DISABLED)",SUFFOLK,"V1:(NO, NOT FEDERALLY REPORTABLE) / V2:(NO, NOT FEDERALLY REPORTABLE)","NO, NOT FEDERALLY REPORTABLE",NO HIT AND RUN,,"NO, SCHOOL BUS NOT INVOLVED",25.0,"YES, DEVICE FUNCTIONING",NO,31806.0,2020,0.558,1463,0.155,350,BOTH SIDES,0,8,0,NO SHOULDER,34,BITUMINOUS CONCRETE ROAD,0,NO SHOULDER,2,0,198,RAISED MEDIAN,LARGE URBANIZED AREA,RURAL OR URBAN PRINCIPAL ARTERIAL,BOSTON (MA-NH-RI),ROTARY,TWO-WAY TRAFFIC,NO ACCESS CONTROL,25.0,MURRAY CIRCLE,ARBORWAY,ARBORWAY,BOSTON,FAIR,LEVEL TERRAIN,PULLED BACK FROM HPMS NETWORK ESTIMATION ROUTINE,,0,0,0,PRINCIPAL ARTERIAL - OTHER,1,NO,36.0,"DCC1:NO IMPROPER DRIVING, DCC2:NOT REPORTED",NOT DISTRACTED,MA,NO,NO,"NO, NOT FEDERALLY REPORTABLE",NOT REPORTED,NO APPARENT INJURY (O),COLLISION WITH MOTOR VEHICLE IN TRAFFIC,1,TRAVELLING STRAIGHT AHEAD,"LIGHT TRUCK(VAN, MINI-VAN, PICKUP, SPORT UTILITY)",MDA1:CENTER FRONT,BOSTON,MA,MA,PAN,SEQ1:COLLISION WITH MOTOR VEHICLE IN TRAFFIC,"YES, VEHICLE OR TRAILER DISABLED",NISS,ROGUE SPOR,,NORTHBOUND,,CENTRE STREET,2023,2,5,Sunday,False
2023,4901070,5230509,BOSTON,02/05/2023,2023-02-05 01:00:00+00:00,OPEN,PROPERTY DAMAGE ONLY (NONE INJURED),NO APPARENT INJURY (O),2,0,0,STATE POLICE,HEAD-ON,V1: TRAVELLING STRAIGHT AHEAD / V2: TRAVELLING STRAIGHT AHEAD,V1: N  / V2: S,V1:(COLLISION WITH MOTOR VEHICLE IN TRAFFIC) V2:(COLLISION WITH MOTOR VEHICLE IN TRAFFIC),DARK - LIGHTED ROADWAY,CLEAR,DRY,COLLISION WITH MOTOR VEHICLE IN TRAFFIC,V1:(COLLISION WITH MOTOR VEHICLE IN TRAFFIC) / V2:(COLLISION WITH MOTOR VEHICLE IN TRAFFIC),"D1: (NO IMPROPER DRIVING)  / D2: (DISREGARDED TRAFFIC SIGNS, SIGNALS, ROAD MARKINGS)","V1:(LIGHT TRUCK(VAN, MINI-VAN, PICKUP, SPORT UTILITY)) / V2:(PASSENGER CAR)",,CENTRE STREET,,ARBORWAY,,TRAFFIC CIRCLE,YIELD SIGNS,"ONE-WAY, NOT DIVIDED",DEPARTMENT OF CONSERVATION AND RECREATION,ROADWAY,,YES,OPERATOR DESIGNATED,231216.95479983,895485.56508913,42.30923035,-71.12136198,2023,D1: NOT DISTRACTED / D2: TALKING ON HAND-HELD ELECTRONIC DEVICE,6,MAPC,V1:(NO) / V2:(NO),"V1:(YES, VEHICLE OR TRAILER DISABLED) / V2:(YES, VEHICLE OR TRAILER DISABLED)",SUFFOLK,"V1:(NO, NOT FEDERALLY REPORTABLE) / V2:(NO, NOT FEDERALLY REPORTABLE)","NO, NOT FEDERALLY REPORTABLE",NO HIT AND RUN,,"NO, SCHOOL BUS NOT INVOLVED",25.0,"YES, DEVICE FUNCTIONING",NO,31806.0,2020,0.558,1463,0.155,350,BOTH SIDES,0,8,0,NO SHOULDER,34,BITUMINOUS CONCRETE ROAD,0,NO SHOULDER,2,0,198,RAISED MEDIAN,LARGE URBANIZED AREA,RURAL OR URBAN PRINCIPAL ARTERIAL,BOSTON (MA-NH-RI),ROTARY,TWO-WAY TRAFFIC,NO ACCESS CONTROL,25.0,MURRAY CIRCLE,ARBORWAY,ARBORWAY,BOSTON,FAIR,LEVEL TERRAIN,PULLED BACK FROM HPMS NETWORK ESTIMATION ROUTINE,,0,0,0,PRINCIPAL ARTERIAL - OTHER,2,NO,61.0,"DCC1:DISREGARDED TRAFFIC SIGNS, SIGNALS, ROAD MARKINGS, DCC2:NOT REPORTED",TALKING ON HAND-HELD ELECTRONIC DEVICE,MA,NO,NO,"NO, NOT FEDERALLY REPORTABLE",NOT REPORTED,NO APPARENT INJURY (O),COLLISION WITH MOTOR VEHICLE IN TRAFFIC,1,TRAVELLING STRAIGHT AHEAD,PASSENGER CAR,"MDA1:CENTER FRONT, MDA2:RIGHT FRONT, MDA3:LEFT FRONT",WATERTOWN,MA,MA,PAN,SEQ1:COLLISION WITH MOTOR VEHICLE IN TRAFFIC,"YES, VEHICLE OR TRAILER DISABLED",HOND,INSIGH,,SOUTHBOUND,,CENTRE STREET,2023,2,5,Sunday,False
2023,4901108,5230471,BOSTON,02/14/2023,2023-02-14 22:45:00+00:00,OPEN,NON-FATAL INJURY,SUSPECTED MINOR INJURY (B),2,1,0,STATE POLICE,REAR-END,V1: TRAVELLING STRAIGHT AHEAD / V2: SLOWING OR STOPPED IN TRAFFIC,V1: N  / V2: N,V1:(COLLISION WITH MOTOR VEHICLE IN TRAFFIC) V2:(COLLISION WITH MOTOR VEHICLE IN TRAFFIC),DARK - LIGHTED ROADWAY,CLEAR,DRY,COLLISION WITH MOTOR VEHICLE IN TRAFFIC,V1:(COLLISION WITH MOTOR VEHICLE IN TRAFFIC) / V2:(COLLISION WITH MOTOR VEHICLE IN TRAFFIC),D1: (FOLLOWED TOO CLOSELY)  / D2: (NO IMPROPER DRIVING),V1:(PASSENGER CAR) / V2:(PASSENGER CAR),,CENTRE STREET,,ALLANDALE STREET,,T-INTERSECTION,TRAFFIC CONTROL SIGNAL,"TWO-WAY, DIVIDED, UNPROTECTED MEDIAN",DEPARTMENT OF CONSERVATION AND RECREATION,ROADWAY,,YES,OFF INTERSECTION,230689.4817,894469.7684,42.30010624,-71.12781351,2023,D2: NOT DISTRACTED,6,MAPC,V1:(NO) / V2:(NO),"V1:(YES, VEHICLE OR TRAILER DISABLED) / V2:(YES, VEHICLE OR TRAILER DISABLED)",SUFFOLK,"V1:(NO, NOT FEDERALLY REPORTABLE) / V2:(NO, NOT FEDERALLY REPORTABLE)","NO, NOT FEDERALLY REPORTABLE",NO HIT AND RUN,,"NO, SCHOOL BUS NOT INVOLVED",25.0,"YES, DEVICE FUNCTIONING",NO,31806.0,2020,0.558,1463,0.155,350,ALL CURBS (DIVIDED HIGHWAY),0,8,0,NO SHOULDER,22,BITUMINOUS CONCRETE ROAD,0,NO SHOULDER,2,2,3,RAISED MEDIAN,LARGE URBANIZED AREA,RURAL OR URBAN PRINCIPAL ARTERIAL,BOSTON (MA-NH-RI),MAINLINE ROADWAY,TWO-WAY TRAFFIC,NO ACCESS CONTROL,35.0,CENTRE STREET,WEST ROXBURY CENTRE STREET ROTARY,MURRAY CIRCLE,BOSTON,FAIR,LEVEL TERRAIN,PULLED BACK FROM HPMS NETWORK ESTIMATION ROUTINE,,0,0,0,PRINCIPAL ARTERIAL - OTHER,1,NO,19.0,"DCC1:FOLLOWED TOO CLOSELY, DCC2:NOT REPORTED",NOT REPORTED,ME,NO,NO,"NO, NOT FEDERALLY REPORTABLE",NOT REPORTED,NO APPARENT INJURY (O),COLLISION WITH MOTOR VEHICLE IN TRAFFIC,1,TRAVELLING STRAIGHT AHEAD,PASSENGER CAR,"MDA1:CENTER FRONT, MDA2:RIGHT FRONT, MDA3:LEFT FRONT",MATTAPAN,MA,MA,PAN,SEQ1:COLLISION WITH MOTOR VEHICLE IN TRAFFIC,"YES, VEHICLE OR TRAILER DISABLED",INFI,FX35,,NORTHBOUND,,CENTRE STREET,2023,2,14,Tuesday,True
2023,4901108,5230471,BOSTON,02/14/2023,2023-02-14 22:45:00+00:00,OPEN,NON-FATAL INJURY,SUSPECTED MINOR INJURY (B),2,1,0,STATE POLICE,REAR-END,V1: TRAVELLING STRAIGHT AHEAD / V2: SLOWING OR STOPPED IN TRAFFIC,V1: N  / V2: N,V1:(COLLISION WITH MOTOR VEHICLE IN TRAFFIC) V2:(COLLISION WITH MOTOR VEHICLE IN TRAFFIC),DARK - LIGHTED ROADWAY,CLEAR,DRY,COLLISION WITH MOTOR VEHICLE IN TRAFFIC,V1:(COLLISION WITH MOTOR VEHICLE IN TRAFFIC) / V2:(COLLISION WITH MOTOR VEHICLE IN TRAFFIC),D1: (FOLLOWED TOO CLOSELY)  / D2: (NO IMPROPER DRIVING),V1:(PASSENGER CAR) / V2:(PASSENGER CAR),,CENTRE STREET,,ALLANDALE STREET,,T-INTERSECTION,TRAFFIC CONTROL SIGNAL,"TWO-WAY, DIVIDED, UNPROTECTED MEDIAN",DEPARTMENT OF CONSERVATION AND RECREATION,ROADWAY,,YES,OFF INTERSECTION,230689.4817,894469.7684,42.30010624,-71.12781351,2023,D2: NOT DISTRACTED,6,MAPC,V1:(NO) / V2:(NO),"V1:(YES, VEHICLE OR TRAILER DISABLED) / V2:(YES, VEHICLE OR TRAILER DISABLED)",SUFFOLK,"V1:(NO, NOT FEDERALLY REPORTABLE) / V2:(NO, NOT FEDERALLY REPORTABLE)","NO, NOT FEDERALLY REPORTABLE",NO HIT AND RUN,,"NO, SCHOOL BUS NOT INVOLVED",25.0,"YES, DEVICE FUNCTIONING",NO,31806.0,2020,0.558,1463,0.155,350,ALL CURBS (DIVIDED HIGHWAY),0,8,0,NO SHOULDER,22,BITUMINOUS CONCRETE ROAD,0,NO SHOULDER,2,2,3,RAISED MEDIAN,LARGE URBANIZED AREA,RURAL OR URBAN PRINCIPAL ARTERIAL,BOSTON (MA-NH-RI),MAINLINE ROADWAY,TWO-WAY TRAFFIC,NO ACCESS CONTROL,35.0,CENTRE STREET,WEST ROXBURY CENTRE STREET ROTARY,MURRAY CIRCLE,BOSTON,FAIR,LEVEL TERRAIN,PULLED BACK FROM HPMS NETWORK ESTIMATION ROUTINE,,0,0,0,PRINCIPAL ARTERIAL - OTHER,2,NO,49.0,"DCC1:NO IMPROPER DRIVING, DCC2:NOT REPORTED",NOT DISTRACTED,MA,NO,NO,"NO, NOT FEDERALLY REPORTABLE",NOT REPORTED,SUSPECTED MINOR INJURY (B),COLLISION WITH MOTOR VEHICLE IN TRAFFIC,1,SLOWING OR STOPPED IN TRAFFIC,PASSENGER CAR,"MDA1:RIGHT REAR, MDA2:CENTER REAR, MDA3:LEFT REAR",WEST ROXBURY,MA,MA,PAN,SEQ1:COLLISION WITH MOTOR VEHICLE IN TRAFFIC,"YES, VEHICLE OR TRAILER DISABLED",TOYT,COROLLA,,NORTHBOUND,,CENTRE STREET,2023,2,14,Tuesday,True
2023,4903813,5233995,BOSTON,03/13/2023,2023-03-13 09:00:00+00:00,OPEN,PROPERTY DAMAGE ONLY (NONE INJURED),NO APPARENT INJURY (O),2,0,0,STATE POLICE,ANGLE,V1: CHANGING LANES / V2: TRAVELLING STRAIGHT AHEAD,V1: N  / V2: N,V1:(COLLISION WITH MOTOR VEHICLE IN TRAFFIC) V2:(COLLISION WITH MOTOR VEHICLE IN TRAFFIC),DAYLIGHT,CLEAR,DRY,COLLISION WITH MOTOR VEHICLE IN TRAFFIC,V1:(COLLISION WITH MOTOR VEHICLE IN TRAFFIC) / V2:(COLLISION WITH MOTOR VEHICLE IN TRAFFIC),D1: (INATTENTION)  / D2: (NO IMPROPER DRIVING),"V1:(PASSENGER CAR) / V2:(LIGHT TRUCK(VAN, MINI-VAN, PICKUP, SPORT UTILITY))",,PRINCE STREET / CENTRE STREET / ARBORWAY,,,,NOT AT JUNCTION,NO CONTROLS,"TWO-WAY, DIVIDED, POSITIVE MEDIAN BARRIER",CITY OR TOWN ACCEPTED ROAD,ROADWAY,,YES,OPERATOR DESIGNATED,231269.38298951,895462.14917058,42.30901745,-71.12072734,2023,D1: NOT DISTRACTED / D2: NOT DISTRACTED,6,MAPC,V1:(NO) / V2:(NO),"V1:(YES, VEHICLE OR TRAILER DISABLED) / V2:(YES, VEHICLE OR TRAILER DISABLED)",SUFFOLK,"V1:(NO, NOT FEDERALLY REPORTABLE) / V2:(NO, NOT FEDERALLY REPORTABLE)","NO, NOT FEDERALLY REPORTABLE",NO HIT AND RUN,,"NO, SCHOOL BUS NOT INVOLVED",35.0,NOT REPORTED,NO,1154.0,,,,,,BOTH SIDES,4,4,0,NO SHOULDER,25,BITUMINOUS CONCRETE ROAD,0,NO SHOULDER,2,0,0,,LARGE URBANIZED AREA,LOCAL,BOSTON (MA-NH-RI),MAINLINE ROADWAY,ONE-WAY TRAFFIC,NO ACCESS CONTROL,,PRINCE STREET,ARBORWAY,CENTRE STREET,BOSTON,FAIR,LEVEL TERRAIN,,,,0,0,LOCAL,1,NO,52.0,"DCC1:INATTENTION, DCC2:NOT REPORTED",NOT DISTRACTED,MA,NO,NO,"NO, NOT FEDERALLY REPORTABLE",NOT REPORTED,NO APPARENT INJURY (O),COLLISION WITH MOTOR VEHICLE IN TRAFFIC,1,CHANGING LANES,PASSENGER CAR,MDA1:RIGHT FRONT,,98,MA,PAN,SEQ1:COLLISION WITH MOTOR VEHICLE IN TRAFFIC,"YES, VEHICLE OR TRAILER DISABLED",,,V1: (89-4A),NORTHBOUND,,CENTRE STREET,2023,3,13,Monday,False
2023,4903813,5233995,BOSTON,03/13/2023,2023-03-13 09:00:00+00:00,OPEN,PROPERTY DAMAGE ONLY (NONE INJURED),NO APPARENT INJURY (O),2,0,0,STATE POLICE,ANGLE,V1: CHANGING LANES / V2: TRAVELLING STRAIGHT AHEAD,V1: N  / V2: N,V1:(COLLISION WITH MOTOR VEHICLE IN TRAFFIC) V2:(COLLISION WITH MOTOR VEHICLE IN TRAFFIC),DAYLIGHT,CLEAR,DRY,COLLISION WITH MOTOR VEHICLE IN TRAFFIC,V1:(COLLISION WITH MOTOR VEHICLE IN TRAFFIC) / V2:(COLLISION WITH MOTOR VEHICLE IN TRAFFIC),D1: (INATTENTION)  / D2: (NO IMPROPER DRIVING),"V1:(PASSENGER CAR) / V2:(LIGHT TRUCK(VAN, MINI-VAN, PICKUP, SPORT UTILITY))",,PRINCE STREET / CENTRE STREET / ARBORWAY,,,,NOT AT JUNCTION,NO CONTROLS,"TWO-WAY, DIVIDED, POSITIVE MEDIAN BARRIER",CITY OR TOWN ACCEPTED ROAD,ROADWAY,,YES,OPERATOR DESIGNATED,231269.38298951,895462.14917058,42.30901745,-71.12072734,2023,D1: NOT DISTRACTED / D2: NOT DISTRACTED,6,MAPC,V1:(NO) / V2:(NO),"V1:(YES, VEHICLE OR TRAILER DISABLED) / V2:(YES, VEHICLE OR TRAILER DISABLED)",SUFFOLK,"V1:(NO, NOT FEDERALLY REPORTABLE) / V2:(NO, NOT FEDERALLY REPORTABLE)","NO, NOT FEDERALLY REPORTABLE",NO HIT AND RUN,,"NO, SCHOOL BUS NOT INVOLVED",35.0,NOT REPORTED,NO,1154.0,,,,,,BOTH SIDES,4,4,0,NO SHOULDER,25,BITUMINOUS CONCRETE ROAD,0,NO SHOULDER,2,0,0,,LARGE URBANIZED AREA,LOCAL,BOSTON (MA-NH-RI),MAINLINE ROADWAY,ONE-WAY TRAFFIC,NO ACCESS CONTROL,,PRINCE STREET,ARBORWAY,CENTRE STREET,BOSTON,FAIR,LEVEL TERRAIN,,,,0,0,LOCAL,2,NO,24.0,"DCC1:NO IMPROPER DRIVING, DCC2:NOT REPORTED",NOT DISTRACTED,MA,NO,NO,"NO, NOT FEDERALLY REPORTABLE",NOT REPORTED,NO APPARENT INJURY (O),COLLISION WITH MOTOR VEHICLE IN TRAFFIC,1,TRAVELLING STRAIGHT AHEAD,"LIGHT TRUCK(VAN, MINI-VAN, PICKUP, SPORT UTILITY)",MDA1:LEFT SIDE,BLOOMINGTON,MN,MA,PAN,SEQ1:COLLISION WITH MOTOR VEHICLE IN TRAFFIC,"YES, VEHICLE OR TRAILER DISABLED",JEEP,GRAND CHER,V1: (89-4A),NORTHBOUND,,CENTRE STREET,2023,3,13,Monday,False
2023,4906509,5236376,BOSTON,03/23/2023,2023-03-23 13:30:00+00:00,OPEN,NON-FATAL INJURY,SUSPECTED MINOR INJURY (B),3,1,0,STATE POLICE,REAR-END,V1: SLOWING OR STOPPED IN TRAFFIC / V2: SLOWING OR STOPPED IN TRAFFIC / V3: SLOWING OR STOPPED IN TRAFFIC,V1: W  / V2: W  / V3: W,V1:(COLLISION WITH MOTOR VEHICLE IN TRAFFIC) V2:(COLLISION WITH MOTOR VEHICLE IN TRAFFIC) V3:(COLLISION WITH MOTOR VEHICLE IN TRAFFIC),DAYLIGHT,CLEAR,DRY,COLLISION WITH MOTOR VEHICLE IN TRAFFIC,V1:(COLLISION WITH MOTOR VEHICLE IN TRAFFIC) / V2:(COLLISION WITH MOTOR VEHICLE IN TRAFFIC) / V3:(COLLISION WITH MOTOR VEHICLE IN TRAFFIC),D1: (FOLLOWED TOO CLOSELY)  / D2: (NO IMPROPER DRIVING)  / D3: (NO IMPROPER DRIVING),V1:(PASSENGER CAR) / V2:(PASSENGER CAR) / V3:(PASSENGER CAR),964,CENTRE STREET RTE UNKNOW,,,,NOT AT JUNCTION,NO CONTROLS,"TWO-WAY, DIVIDED, POSITIVE MEDIAN BARRIER",DEPARTMENT OF CONSERVATION AND RECREATION,ROADWAY,,YES,AT ADDRESS,231047.45265548,895252.48614442,42.30713875,-71.12343037,2023,D1: NOT DISTRACTED / D2: NOT DISTRACTED / D3: NOT DISTRACTED,6,MAPC,V1:(NO) / V2:(NO) / V3:(NO),"V1:(YES, VEHICLE OR TRAILER DISABLED) / V2:(YES, OTHER REASON NOT DISABLED) / V3:(YES, OTHER REASON NOT DISABLED)",SUFFOLK,"V1:(NO, NOT FEDERALLY REPORTABLE) / V2:(NO, NOT FEDERALLY REPORTABLE) / V3:(NO, NOT FEDERALLY REPORTABLE)","NO, NOT FEDERALLY REPORTABLE",NO HIT AND RUN,,"NO, SCHOOL BUS NOT INVOLVED",25.0,NOT REPORTED,NO,31806.0,2020,0.558,1463,0.155,350,ALL CURBS (DIVIDED HIGHWAY),0,8,0,NO SHOULDER,22,BITUMINOUS CONCRETE ROAD,0,NO SHOULDER,2,2,3,RAISED MEDIAN,LARGE URBANIZED AREA,RURAL OR URBAN PRINCIPAL ARTERIAL,BOSTON (MA-NH-RI),MAINLINE ROADWAY,TWO-WAY TRAFFIC,NO ACCESS CONTROL,35.0,CENTRE STREET,WEST ROXBURY CENTRE STREET ROTARY,MURRAY CIRCLE,BOSTON,FAIR,LEVEL TERRAIN,PULLED BACK FROM HPMS NETWORK ESTIMATION ROUTINE,,0,0,0,PRINCIPAL ARTERIAL - OTHER,1,NO,26.0,"DCC1:FOLLOWED TOO CLOSELY, DCC2:NOT REPORTED",NOT DISTRACTED,MA,NO,NO,"NO, NOT FEDERALLY REPORTABLE",NOT REPORTED,SUSPECTED MINOR INJURY (B),COLLISION WITH MOTOR VEHICLE IN TRAFFIC,1,SLOWING OR STOPPED IN TRAFFIC,PASSENGER CAR,MDA1:CENTER FRONT,BOSTON,MA,MA,PAN,SEQ1:COLLISION WITH MOTOR VEHICLE IN TRAFFIC,"YES, VEHICLE OR TRAILER DISABLED",TOYT,COROLL,V1: (720 906-B),WESTBOUND,,CENTRE STREET,2023,3,23,Thursday,True
2023,4906509,5236376,BOSTON,03/23/2023,2023-03-23 13:30:00+00:00,OPEN,NON-FATAL INJURY,SUSPECTED MINOR INJURY (B),3,1,0,STATE POLICE,REAR-END,V1: SLOWING OR STOPPED IN TRAFFIC / V2: SLOWING OR STOPPED IN TRAFFIC / V3: SLOWING OR STOPPED IN TRAFFIC,V1: W  / V2: W  / V3: W,V1:(COLLISION WITH MOTOR VEHICLE IN TRAFFIC) V2:(COLLISION WITH MOTOR VEHICLE IN TRAFFIC) V3:(COLLISION WITH MOTOR VEHICLE IN TRAFFIC),DAYLIGHT,CLEAR,DRY,COLLISION WITH MOTOR VEHICLE IN TRAFFIC,V1:(COLLISION WITH MOTOR VEHICLE IN TRAFFIC) / V2:(COLLISION WITH MOTOR VEHICLE IN TRAFFIC) / V3:(COLLISION WITH MOTOR VEHICLE IN TRAFFIC),D1: (FOLLOWED TOO CLOSELY)  / D2: (NO IMPROPER DRIVING)  / D3: (NO IMPROPER DRIVING),V1:(PASSENGER CAR) / V2:(PASSENGER CAR) / V3:(PASSENGER CAR),964,CENTRE STREET RTE UNKNOW,,,,NOT AT JUNCTION,NO CONTROLS,"TWO-WAY, DIVIDED, POSITIVE MEDIAN BARRIER",DEPARTMENT OF CONSERVATION AND RECREATION,ROADWAY,,YES,AT ADDRESS,231047.45265548,895252.48614442,42.30713875,-71.12343037,2023,D1: NOT DISTRACTED / D2: NOT DISTRACTED / D3: NOT DISTRACTED,6,MAPC,V1:(NO) / V2:(NO) / V3:(NO),"V1:(YES, VEHICLE OR TRAILER DISABLED) / V2:(YES, OTHER REASON NOT DISABLED) / V3:(YES, OTHER REASON NOT DISABLED)",SUFFOLK,"V1:(NO, NOT FEDERALLY REPORTABLE) / V2:(NO, NOT FEDERALLY REPORTABLE) / V3:(NO, NOT FEDERALLY REPORTABLE)","NO, NOT FEDERALLY REPORTABLE",NO HIT AND RUN,,"NO, SCHOOL BUS NOT INVOLVED",25.0,NOT REPORTED,NO,31806.0,2020,0.558,1463,0.155,350,ALL CURBS (DIVIDED HIGHWAY),0,8,0,NO SHOULDER,22,BITUMINOUS CONCRETE ROAD,0,NO SHOULDER,2,2,3,RAISED MEDIAN,LARGE URBANIZED AREA,RURAL OR URBAN PRINCIPAL ARTERIAL,BOSTON (MA-NH-RI),MAINLINE ROADWAY,TWO-WAY TRAFFIC,NO ACCESS CONTROL,35.0,CENTRE STREET,WEST ROXBURY CENTRE STREET ROTARY,MURRAY CIRCLE,BOSTON,FAIR,LEVEL TERRAIN,PULLED BACK FROM HPMS NETWORK ESTIMATION ROUTINE,,0,0,0,PRINCIPAL ARTERIAL - OTHER,2,NO,53.0,"DCC1:NO IMPROPER DRIVING, DCC2:NOT REPORTED",NOT DISTRACTED,MA,NO,NO,"NO, NOT FEDERALLY REPORTABLE",NOT REPORTED,NO APPARENT INJURY (O),COLLISION WITH MOTOR VEHICLE IN TRAFFIC,1,SLOWING OR STOPPED IN TRAFFIC,PASSENGER CAR,MDA1:CENTER REAR,BOSTON,MA,MA,PAN,SEQ1:COLLISION WITH MOTOR VEHICLE IN TRAFFIC,"YES, OTHER REASON NOT DISABLED",MERZ,CLS,V1: (720 906-B),WESTBOUND,,CENTRE STREET,2023,3,23,Thursday,True
2023,4906509,5236376,BOSTON,03/23/2023,2023-03-23 13:30:00+00:00,OPEN,NON-FATAL INJURY,SUSPECTED MINOR INJURY (B),3,1,0,STATE POLICE,REAR-END,V1: SLOWING OR STOPPED IN TRAFFIC / V2: SLOWING OR STOPPED IN TRAFFIC / V3: SLOWING OR STOPPED IN TRAFFIC,V1: W  / V2: W  / V3: W,V1:(COLLISION WITH MOTOR VEHICLE IN TRAFFIC) V2:(COLLISION WITH MOTOR VEHICLE IN TRAFFIC) V3:(COLLISION WITH MOTOR VEHICLE IN TRAFFIC),DAYLIGHT,CLEAR,DRY,COLLISION WITH MOTOR VEHICLE IN TRAFFIC,V1:(COLLISION WITH MOTOR VEHICLE IN TRAFFIC) / V2:(COLLISION WITH MOTOR VEHICLE IN TRAFFIC) / V3:(COLLISION WITH MOTOR VEHICLE IN TRAFFIC),D1: (FOLLOWED TOO CLOSELY)  / D2: (NO IMPROPER DRIVING)  / D3: (NO IMPROPER DRIVING),V1:(PASSENGER CAR) / V2:(PASSENGER CAR) / V3:(PASSENGER CAR),964,CENTRE STREET RTE UNKNOW,,,,NOT AT JUNCTION,NO CONTROLS,"TWO-WAY, DIVIDED, POSITIVE MEDIAN BARRIER",DEPARTMENT OF CONSERVATION AND RECREATION,ROADWAY,,YES,AT ADDRESS,231047.45265548,895252.48614442,42.30713875,-71.12343037,2023,D1: NOT DISTRACTED / D2: NOT DISTRACTED / D3: NOT DISTRACTED,6,MAPC,V1:(NO) / V2:(NO) / V3:(NO),"V1:(YES, VEHICLE OR TRAILER DISABLED) / V2:(YES, OTHER REASON NOT DISABLED) / V3:(YES, OTHER REASON NOT DISABLED)",SUFFOLK,"V1:(NO, NOT FEDERALLY REPORTABLE) / V2:(NO, NOT FEDERALLY REPORTABLE) / V3:(NO, NOT FEDERALLY REPORTABLE)","NO, NOT FEDERALLY REPORTABLE",NO HIT AND RUN,,"NO, SCHOOL BUS NOT INVOLVED",25.0,NOT REPORTED,NO,31806.0,2020,0.558,1463,0.155,350,ALL CURBS (DIVIDED HIGHWAY),0,8,0,NO SHOULDER,22,BITUMINOUS CONCRETE ROAD,0,NO SHOULDER,2,2,3,RAISED MEDIAN,LARGE URBANIZED AREA,RURAL OR URBAN PRINCIPAL ARTERIAL,BOSTON (MA-NH-RI),MAINLINE ROADWAY,TWO-WAY TRAFFIC,NO ACCESS CONTROL,35.0,CENTRE STREET,WEST ROXBURY CENTRE STREET ROTARY,MURRAY CIRCLE,BOSTON,FAIR,LEVEL TERRAIN,PULLED BACK FROM HPMS NETWORK ESTIMATION ROUTINE,,0,0,0,PRINCIPAL ARTERIAL - OTHER,3,NO,42.0,"DCC1:NO IMPROPER DRIVING, DCC2:NOT REPORTED",NOT DISTRACTED,MA,NO,NO,"NO, NOT FEDERALLY REPORTABLE",NOT REPORTED,NO APPARENT INJURY (O),COLLISION WITH MOTOR VEHICLE IN TRAFFIC,1,SLOWING OR STOPPED IN TRAFFIC,PASSENGER CAR,"MDA1:CENTER FRONT, MDA2:CENTER REAR",HYDE PARK,MA,MA,PAN,SEQ1:COLLISION WITH MOTOR VEHICLE IN TRAFFIC,"YES, OTHER REASON NOT DISABLED",HOND,FIT,V1: (720 906-B),WESTBOUND,,CENTRE STREET,2023,3,23,Thursday,True
2023,4908706,5238384,BOSTON,02/22/2023,2023-02-22 15:08:00+00:00,OPEN,NON-FATAL INJURY,SUSPECTED MINOR INJURY (B),2,3,0,MBTA POLICE,ANGLE,V1: TURNING LEFT / V2: SLOWING OR STOPPED IN TRAFFIC,V1: E  / V2: S,V1:(COLLISION WITH MOTOR VEHICLE IN TRAFFIC) V2:(COLLISION WITH MOTOR VEHICLE IN TRAFFIC),DAYLIGHT,CLOUDY,DRY,COLLISION WITH MOTOR VEHICLE IN TRAFFIC,V1:(COLLISION WITH MOTOR VEHICLE IN TRAFFIC) / V2:(COLLISION WITH MOTOR VEHICLE IN TRAFFIC),"D1: (OPERATING VEHICLE IN ERRATIC, RECKLESS, CARELESS, NEGLIGENT OR AGGRESSIVE MANNER),(DISREGARDED TRAFFIC SIGNS, SIGNALS, ROAD MARKINGS)  / D2: (NO IMPROPER DRIVING)","V1:(PASSENGER CAR) / V2:(BUS (SEATS FOR 16 OR MORE, INCLUDING DRIVER))",,CENTRE STREET RTE    / CEDAR STREET RTE,,,,FOUR-WAY INTERSECTION,TRAFFIC CONTROL SIGNAL,"TWO-WAY, NOT DIVIDED",CITY OR TOWN ACCEPTED ROAD,ROADWAY,,YES,AT INTERSECTION,233325.5936,897543.4375,42.32766977,-71.09566784,2023,D2: NOT DISTRACTED,6,MAPC,V1:(NO) / V2:(NO),V1:(NO) / V2:(NO),SUFFOLK,"V1:(NO, NOT FEDERALLY REPORTABLE) / V2:(YES, FEDERALLY REPORTABLE)","YES, FEDERALLY REPORTABLE","YES, HIT AND RUN",,"NO, SCHOOL BUS NOT INVOLVED",,"YES, DEVICE FUNCTIONING",NO,8969.0,2020,0.253,440,0,53,BOTH SIDES,10,10,0,NO SHOULDER,41,BITUMINOUS CONCRETE ROAD,0,NO SHOULDER,2,0,0,,LARGE URBANIZED AREA,URBAN MINOR ARTERIAL OR RURAL MAJOR COLLECTOR,BOSTON (MA-NH-RI),MAINLINE ROADWAY,TWO-WAY TRAFFIC,NO ACCESS CONTROL,99.0,CENTRE STREET,COLUMBUS AVENUE,ROXBURY STREET,BOSTON,FAIR,LEVEL TERRAIN,GROWN FROM PRIOR YEAR HPMS NETWORK,,99,0,0,MINOR ARTERIAL,1,,,"DCC1:OPERATING VEHICLE IN ERRATIC, RECKLESS, CARELESS, NEGLIGENT OR AGGRESSIVE MANNER, DCC2:DISREGARDED TRAFFIC SIGNS, SIGNALS, ROAD MARKINGS",,,,NO,"NO, NOT FEDERALLY REPORTABLE",NOT REPORTED,,COLLISION WITH MOTOR VEHICLE IN TRAFFIC,1,TURNING LEFT,PASSENGER CAR,MDA1:LEFT REAR,WINCHENDON,MA,MA,PAN,SEQ1:COLLISION WITH MOTOR VEHICLE IN TRAFFIC,NO,HYUN,,,EASTBOUND,,CENTRE STREET,2023,2,22,Wednesday,True
2023,4908706,5238384,BOSTON,02/22/2023,2023-02-22 15:08:00+00:00,OPEN,NON-FATAL INJURY,SUSPECTED MINOR INJURY (B),2,3,0,MBTA POLICE,ANGLE,V1: TURNING LEFT / V2: SLOWING OR STOPPED IN TRAFFIC,V1: E  / V2: S,V1:(COLLISION WITH MOTOR VEHICLE IN TRAFFIC) V2:(COLLISION WITH MOTOR VEHICLE IN TRAFFIC),DAYLIGHT,CLOUDY,DRY,COLLISION WITH MOTOR VEHICLE IN TRAFFIC,V1:(COLLISION WITH MOTOR VEHICLE IN TRAFFIC) / V2:(COLLISION WITH MOTOR VEHICLE IN TRAFFIC),"D1: (OPERATING VEHICLE IN ERRATIC, RECKLESS, CARELESS, NEGLIGENT OR AGGRESSIVE MANNER),(DISREGARDED TRAFFIC SIGNS, SIGNALS, ROAD MARKINGS)  / D2: (NO IMPROPER DRIVING)","V1:(PASSENGER CAR) / V2:(BUS (SEATS FOR 16 OR MORE, INCLUDING DRIVER))",,CENTRE STREET RTE    / CEDAR STREET RTE,,,,FOUR-WAY INTERSECTION,TRAFFIC CONTROL SIGNAL,"TWO-WAY, NOT DIVIDED",CITY OR TOWN ACCEPTED ROAD,ROADWAY,,YES,AT INTERSECTION,233325.5936,897543.4375,42.32766977,-71.09566784,2023,D2: NOT DISTRACTED,6,MAPC,V1:(NO) / V2:(NO),V1:(NO) / V2:(NO),SUFFOLK,"V1:(NO, NOT FEDERALLY REPORTABLE) / V2:(YES, FEDERALLY REPORTABLE)","YES, FEDERALLY REPORTABLE","YES, HIT AND RUN",,"NO, SCHOOL BUS NOT INVOLVED",,"YES, DEVICE FUNCTIONING",NO,8969.0,2020,0.253,440,0,53,BOTH SIDES,10,10,0,NO SHOULDER,41,BITUMINOUS CONCRETE ROAD,0,NO SHOULDER,2,0,0,,LARGE URBANIZED AREA,URBAN MINOR ARTERIAL OR RURAL MAJOR COLLECTOR,BOSTON (MA-NH-RI),MAINLINE ROADWAY,TWO-WAY TRAFFIC,NO ACCESS CONTROL,99.0,CENTRE STREET,COLUMBUS AVENUE,ROXBURY STREET,BOSTON,FAIR,LEVEL TERRAIN,GROWN FROM PRIOR YEAR HPMS NETWORK,,99,0,0,MINOR ARTERIAL,2,NO,37.0,"DCC1:NO IMPROPER DRIVING, DCC2:NOT REPORTED",NOT DISTRACTED,MA,NO,NO,"YES, FEDERALLY REPORTABLE",NOT REPORTED,SUSPECTED MINOR INJURY (B),COLLISION WITH MOTOR VEHICLE IN TRAFFIC,4,SLOWING OR STOPPED IN TRAFFIC,"BUS (SEATS FOR 16 OR MORE, INCLUDING DRIVER)",MDA1:CENTER FRONT,BOSTON,MA,MA,ATN,SEQ1:COLLISION WITH MOTOR VEHICLE IN TRAFFIC,NO,NFLY,,,SOUTHBOUND,,CENTRE STREET,2023,2,22,Wednesday,True
2023,4910737,5239934,BOSTON,03/24/2023,2023-03-24 06:51:00+00:00,OPEN,PROPERTY DAMAGE ONLY (NONE INJURED),NO APPARENT INJURY (O),1,0,0,STATE POLICE,SINGLE VEHICLE CRASH,V1: TRAVELLING STRAIGHT AHEAD,V1: N,V1:(COLLISION WITH ANIMAL - DEER),DAWN,CLEAR,DRY,COLLISION WITH ANIMAL - DEER,V1:(COLLISION WITH ANIMAL - DEER),D1: (NO IMPROPER DRIVING),V1:(PASSENGER CAR),,CENTRE STREET,,WHITCOMB AVENUE,,NOT AT JUNCTION,NO CONTROLS,"TWO-WAY, DIVIDED, UNPROTECTED MEDIAN",DEPARTMENT OF CONSERVATION AND RECREATION,ROADWAY,,YES,OPERATOR DESIGNATED,230820.34086991,894645.51940435,42.30168334,-71.1262172,2023,D1: NOT DISTRACTED,6,MAPC,V1:(NO),"V1:(YES, OTHER REASON NOT DISABLED)",SUFFOLK,"V1:(NO, NOT FEDERALLY REPORTABLE)","NO, NOT FEDERALLY REPORTABLE",NO HIT AND RUN,,"NO, SCHOOL BUS NOT INVOLVED",25.0,NOT REPORTED,NO,31806.0,2020,0.558,1463,0.155,350,ALL CURBS (DIVIDED HIGHWAY),0,8,0,NO SHOULDER,22,BITUMINOUS CONCRETE ROAD,0,NO SHOULDER,2,2,3,RAISED MEDIAN,LARGE URBANIZED AREA,RURAL OR URBAN PRINCIPAL ARTERIAL,BOSTON (MA-NH-RI),MAINLINE ROADWAY,TWO-WAY TRAFFIC,NO ACCESS CONTROL,35.0,CENTRE STREET,WEST ROXBURY CENTRE STREET ROTARY,MURRAY CIRCLE,BOSTON,FAIR,LEVEL TERRAIN,PULLED BACK FROM HPMS NETWORK ESTIMATION ROUTINE,,0,0,0,PRINCIPAL ARTERIAL - OTHER,1,NO,54.0,"DCC1:NO IMPROPER DRIVING, DCC2:NOT REPORTED",NOT DISTRACTED,MA,NO,NO,"NO, NOT FEDERALLY REPORTABLE",NOT REPORTED,NO APPARENT INJURY (O),COLLISION WITH ANIMAL - DEER,1,TRAVELLING STRAIGHT AHEAD,PASSENGER CAR,"MDA1:CENTER FRONT, MDA2:LEFT FRONT",DEDHAM,MA,MA,PAN,SEQ1:COLLISION WITH ANIMAL - DEER,"YES, OTHER REASON NOT DISABLED",TOYT,COROLL,,NORTHBOUND,,CENTRE STREET,2023,3,24,Friday,False
2023,4911221,5240737,BOSTON,04/06/2023,2023-04-06 16:34:00+00:00,OPEN,PROPERTY DAMAGE ONLY (NONE INJURED),NO APPARENT INJURY (O),2,0,0,LOCAL POLICE,REAR-END,V1: SLOWING OR STOPPED IN TRAFFIC / V2: TRAVELLING STRAIGHT AHEAD,V1: S  / V2: S,V1:(COLLISION WITH MOTOR VEHICLE IN TRAFFIC) V2:(COLLISION WITH PARKED MOTOR VEHICLE),DAYLIGHT,CLEAR,DRY,COLLISION WITH PARKED MOTOR VEHICLE,V1:(COLLISION WITH MOTOR VEHICLE IN TRAFFIC) / V2:(COLLISION WITH PARKED MOTOR VEHICLE),D1: (NO IMPROPER DRIVING)  / D2: (FOLLOWED TOO CLOSELY),V1:(PASSENGER CAR) / V2:(PASSENGER CAR),,HEATH STREET RTE UNKNOW / COLUMBUS AVENUE RTE SR28 S  / RTE L09105 N,,,,T-INTERSECTION,TRAFFIC CONTROL SIGNAL,"TWO-WAY, DIVIDED, POSITIVE MEDIAN BARRIER",CITY OR TOWN ACCEPTED ROAD,ROADWAY,,YES,OPERATOR DESIGNATED,233100.8312,897238.0954,42.32493038,-71.09841227,2023,D1: NOT DISTRACTED,6,MAPC,V1:(NO) / V2:(NO),V1:(NO) / V2:(NO),SUFFOLK,"V1:(NO, NOT FEDERALLY REPORTABLE) / V2:(NO, NOT FEDERALLY REPORTABLE)","NO, NOT FEDERALLY REPORTABLE",NO HIT AND RUN,,"NO, SCHOOL BUS NOT INVOLVED",25.0,NOT REPORTED,NO,9099.0,2020,0.253,445,0,54,BOTH SIDES,8,8,0,NO SHOULDER,34,BITUMINOUS CONCRETE ROAD,0,NO SHOULDER,2,0,0,,LARGE URBANIZED AREA,URBAN MINOR ARTERIAL OR RURAL MAJOR COLLECTOR,BOSTON (MA-NH-RI),MAINLINE ROADWAY,TWO-WAY TRAFFIC,NO ACCESS CONTROL,99.0,CENTRE STREET,COLUMBUS AVENUE,ROXBURY STREET,BOSTON,FAIR,LEVEL TERRAIN,GROWN FROM PRIOR YEAR HPMS NETWORK,,99,0,0,MINOR ARTERIAL,1,NO,62.0,"DCC1:NO IMPROPER DRIVING, DCC2:NOT REPORTED",NOT DISTRACTED,MA,NO,NO,"NO, NOT FEDERALLY REPORTABLE",NOT REPORTED,NO APPARENT INJURY (O),COLLISION WITH MOTOR VEHICLE IN TRAFFIC,1,SLOWING OR STOPPED IN TRAFFIC,PASSENGER CAR,"MDA1:RIGHT REAR, MDA2:CENTER REAR, MDA3:LEFT REAR",MATTAPAN,MA,96,PAN,SEQ1:COLLISION WITH MOTOR VEHICLE IN TRAFFIC,NO,TOYOTA,CAMRY,,SOUTHBOUND,,CENTRE STREET,2023,4,6,Thursday,False
2023,4911221,5240737,BOSTON,04/06/2023,2023-04-06 16:34:00+00:00,OPEN,PROPERTY DAMAGE ONLY (NONE INJURED),NO APPARENT INJURY (O),2,0,0,LOCAL POLICE,REAR-END,V1: SLOWING OR STOPPED IN TRAFFIC / V2: TRAVELLING STRAIGHT AHEAD,V1: S  / V2: S,V1:(COLLISION WITH MOTOR VEHICLE IN TRAFFIC) V2:(COLLISION WITH PARKED MOTOR VEHICLE),DAYLIGHT,CLEAR,DRY,COLLISION WITH PARKED MOTOR VEHICLE,V1:(COLLISION WITH MOTOR VEHICLE IN TRAFFIC) / V2:(COLLISION WITH PARKED MOTOR VEHICLE),D1: (NO IMPROPER DRIVING)  / D2: (FOLLOWED TOO CLOSELY),V1:(PASSENGER CAR) / V2:(PASSENGER CAR),,HEATH STREET RTE UNKNOW / COLUMBUS AVENUE RTE SR28 S  / RTE L09105 N,,,,T-INTERSECTION,TRAFFIC CONTROL SIGNAL,"TWO-WAY, DIVIDED, POSITIVE MEDIAN BARRIER",CITY OR TOWN ACCEPTED ROAD,ROADWAY,,YES,OPERATOR DESIGNATED,233100.8312,897238.0954,42.32493038,-71.09841227,2023,D1: NOT DISTRACTED,6,MAPC,V1:(NO) / V2:(NO),V1:(NO) / V2:(NO),SUFFOLK,"V1:(NO, NOT FEDERALLY REPORTABLE) / V2:(NO, NOT FEDERALLY REPORTABLE)","NO, NOT FEDERALLY REPORTABLE",NO HIT AND RUN,,"NO, SCHOOL BUS NOT INVOLVED",25.0,NOT REPORTED,NO,9099.0,2020,0.253,445,0,54,BOTH SIDES,8,8,0,NO SHOULDER,34,BITUMINOUS CONCRETE ROAD,0,NO SHOULDER,2,0,0,,LARGE URBANIZED AREA,URBAN MINOR ARTERIAL OR RURAL MAJOR COLLECTOR,BOSTON (MA-NH-RI),MAINLINE ROADWAY,TWO-WAY TRAFFIC,NO ACCESS CONTROL,99.0,CENTRE STREET,COLUMBUS AVENUE,ROXBURY STREET,BOSTON,FAIR,LEVEL TERRAIN,GROWN FROM PRIOR YEAR HPMS NETWORK,,99,0,0,MINOR ARTERIAL,2,NO,29.0,"DCC1:FOLLOWED TOO CLOSELY, DCC2:NOT REPORTED",,MA,NO,NO,"NO, NOT FEDERALLY REPORTABLE",NOT REPORTED,NO APPARENT INJURY (O),COLLISION WITH PARKED MOTOR VEHICLE,1,TRAVELLING STRAIGHT AHEAD,PASSENGER CAR,"MDA1:RIGHT FRONT, MDA2:CENTER FRONT, MDA3:LEFT FRONT",BOSTON,MA,96,PAN,SEQ1:COLLISION WITH PARKED MOTOR VEHICLE,NO,NISSAN,ALTIMA,,SOUTHBOUND,,CENTRE STREET,2023,4,6,Thursday,False
2023,4911342,5241185,BOSTON,03/30/2023,2023-03-30 06:42:00+00:00,OPEN,PROPERTY DAMAGE ONLY (NONE INJURED),NO APPARENT INJURY (O),2,0,0,STATE POLICE,REAR-END,V1: ENTERING TRAFFIC LANE / V2: SLOWING OR STOPPED IN TRAFFIC,V1: N  / V2: N,V1:(COLLISION WITH MOTOR VEHICLE IN TRAFFIC) V2:(COLLISION WITH MOTOR VEHICLE IN TRAFFIC),DAYLIGHT,CLEAR,DRY,COLLISION WITH MOTOR VEHICLE IN TRAFFIC,V1:(COLLISION WITH MOTOR VEHICLE IN TRAFFIC) / V2:(COLLISION WITH MOTOR VEHICLE IN TRAFFIC),D1: (FAILED TO YIELD RIGHT OF WAY)  / D2: (NO IMPROPER DRIVING),V1:(PASSENGER CAR) / V2:(PASSENGER CAR),,CENTRE STREET,,WALTER STREET,,ON-RAMP,YIELD SIGNS,"TWO-WAY, DIVIDED, POSITIVE MEDIAN BARRIER",DEPARTMENT OF CONSERVATION AND RECREATION,ROADWAY,,YES,OFF INTERSECTION,230518.3708,894246.2134,42.29810032,-71.1299004,2023,D1: NOT DISTRACTED / D2: NOT DISTRACTED,6,MAPC,V1:(NO) / V2:(NO),"V1:(YES, OTHER REASON NOT DISABLED) / V2:(YES, VEHICLE OR TRAILER DISABLED)",SUFFOLK,"V1:(NO, NOT FEDERALLY REPORTABLE) / V2:(NO, NOT FEDERALLY REPORTABLE)","NO, NOT FEDERALLY REPORTABLE",NO HIT AND RUN,,"NO, SCHOOL BUS NOT INVOLVED",35.0,NOT REPORTED,NO,31806.0,2020,0.558,1463,0.155,350,ALL CURBS (DIVIDED HIGHWAY),0,8,0,NO SHOULDER,22,BITUMINOUS CONCRETE ROAD,0,NO SHOULDER,2,2,3,RAISED MEDIAN,LARGE URBANIZED AREA,RURAL OR URBAN PRINCIPAL ARTERIAL,BOSTON (MA-NH-RI),MAINLINE ROADWAY,TWO-WAY TRAFFIC,NO ACCESS CONTROL,35.0,CENTRE STREET,WEST ROXBURY CENTRE STREET ROTARY,MURRAY CIRCLE,BOSTON,FAIR,LEVEL TERRAIN,PULLED BACK FROM HPMS NETWORK ESTIMATION ROUTINE,,0,0,0,PRINCIPAL ARTERIAL - OTHER,1,NO,31.0,"DCC1:FAILED TO YIELD RIGHT OF WAY, DCC2:NOT REPORTED",NOT DISTRACTED,MA,NO,NO,"NO, NOT FEDERALLY REPORTABLE",NOT REPORTED,NO APPARENT INJURY (O),COLLISION WITH MOTOR VEHICLE IN TRAFFIC,1,ENTERING TRAFFIC LANE,PASSENGER CAR,MDA1:CENTER FRONT,NORTON,MA,MA,PAN,SEQ1:COLLISION WITH MOTOR VEHICLE IN TRAFFIC,"YES, OTHER REASON NOT DISABLED",TOYT,CAMRYS,,NORTHBOUND,,CENTRE STREET,2023,3,30,Thursday,False
2023,4911342,5241185,BOSTON,03/30/2023,2023-03-30 06:42:00+00:00,OPEN,PROPERTY DAMAGE ONLY (NONE INJURED),NO APPARENT INJURY (O),2,0,0,STATE POLICE,REAR-END,V1: ENTERING TRAFFIC LANE / V2: SLOWING OR STOPPED IN TRAFFIC,V1: N  / V2: N,V1:(COLLISION WITH MOTOR VEHICLE IN TRAFFIC) V2:(COLLISION WITH MOTOR VEHICLE IN TRAFFIC),DAYLIGHT,CLEAR,DRY,COLLISION WITH MOTOR VEHICLE IN TRAFFIC,V1:(COLLISION WITH MOTOR VEHICLE IN TRAFFIC) / V2:(COLLISION WITH MOTOR VEHICLE IN TRAFFIC),D1: (FAILED TO YIELD RIGHT OF WAY)  / D2: (NO IMPROPER DRIVING),V1:(PASSENGER CAR) / V2:(PASSENGER CAR),,CENTRE STREET,,WALTER STREET,,ON-RAMP,YIELD SIGNS,"TWO-WAY, DIVIDED, POSITIVE MEDIAN BARRIER",DEPARTMENT OF CONSERVATION AND RECREATION,ROADWAY,,YES,OFF INTERSECTION,230518.3708,894246.2134,42.29810032,-71.1299004,2023,D1: NOT DISTRACTED / D2: NOT DISTRACTED,6,MAPC,V1:(NO) / V2:(NO),"V1:(YES, OTHER REASON NOT DISABLED) / V2:(YES, VEHICLE OR TRAILER DISABLED)",SUFFOLK,"V1:(NO, NOT FEDERALLY REPORTABLE) / V2:(NO, NOT FEDERALLY REPORTABLE)","NO, NOT FEDERALLY REPORTABLE",NO HIT AND RUN,,"NO, SCHOOL BUS NOT INVOLVED",35.0,NOT REPORTED,NO,31806.0,2020,0.558,1463,0.155,350,ALL CURBS (DIVIDED HIGHWAY),0,8,0,NO SHOULDER,22,BITUMINOUS CONCRETE ROAD,0,NO SHOULDER,2,2,3,RAISED MEDIAN,LARGE URBANIZED AREA,RURAL OR URBAN PRINCIPAL ARTERIAL,BOSTON (MA-NH-RI),MAINLINE ROADWAY,TWO-WAY TRAFFIC,NO ACCESS CONTROL,35.0,CENTRE STREET,WEST ROXBURY CENTRE STREET ROTARY,MURRAY CIRCLE,BOSTON,FAIR,LEVEL TERRAIN,PULLED BACK FROM HPMS NETWORK ESTIMATION ROUTINE,,0,0,0,PRINCIPAL ARTERIAL - OTHER,2,NO,41.0,"DCC1:NO IMPROPER DRIVING, DCC2:NOT REPORTED",NOT DISTRACTED,MA,NO,NO,"NO, NOT FEDERALLY REPORTABLE",NOT REPORTED,NO APPARENT INJURY (O),COLLISION WITH MOTOR VEHICLE IN TRAFFIC,1,SLOWING OR STOPPED IN TRAFFIC,PASSENGER CAR,MDA1:CENTER REAR,ROSLINDALE,MA,MA,PAN,SEQ1:COLLISION WITH MOTOR VEHICLE IN TRAFFIC,"YES, VEHICLE OR TRAILER DISABLED",HOND,FIT,,NORTHBOUND,,CENTRE STREET,2023,3,30,Thursday,False
2023,4912089,5241795,BOSTON,03/27/2023,2023-03-27 10:22:00+00:00,OPEN,NON-FATAL INJURY,POSSIBLE INJURY (C),2,1,0,STATE POLICE,"SIDESWIPE, SAME DIRECTION",V1: TRAVELLING STRAIGHT AHEAD / V2: CHANGING LANES,V1: E  / V2: E,V1:(COLLISION WITH MOTOR VEHICLE IN TRAFFIC) V2:(COLLISION WITH MOTOR VEHICLE IN TRAFFIC),DAYLIGHT,CLEAR,DRY,COLLISION WITH MOTOR VEHICLE IN TRAFFIC,V1:(COLLISION WITH MOTOR VEHICLE IN TRAFFIC) / V2:(COLLISION WITH MOTOR VEHICLE IN TRAFFIC),D1: (NO IMPROPER DRIVING)  / D2: (FAILED TO YIELD RIGHT OF WAY),"V1:(LIGHT TRUCK(VAN, MINI-VAN, PICKUP, SPORT UTILITY)) / V2:(PASSENGER CAR)",,ARBORWAY / SOUTH STREET,,,,NOT AT JUNCTION,TRAFFIC CONTROL SIGNAL,"TWO-WAY, DIVIDED, UNPROTECTED MEDIAN",MASSACHUSETTS DEPARTMENT OF TRANSPORTATION,ROADWAY,,YES,AT INTERSECTION,231786.2037,894655.2407,42.30173216,-71.11450304,2023,D1: NOT DISTRACTED / D2: NOT DISTRACTED,6,MAPC,V1:(NO) / V2:(NO),"V1:(YES, OTHER REASON NOT DISABLED) / V2:(YES, OTHER REASON NOT DISABLED)",SUFFOLK,"V1:(NO, NOT FEDERALLY REPORTABLE) / V2:(NO, NOT FEDERALLY REPORTABLE)","NO, NOT FEDERALLY REPORTABLE",NO HIT AND RUN,,"NO, SCHOOL BUS NOT INVOLVED",30.0,"YES, DEVICE FUNCTIONING",NO,19453.0,2020,,,,,BOTH SIDES,0,6,0,NO SHOULDER,22,BITUMINOUS CONCRETE ROAD,0,NO SHOULDER,2,2,0,RAISED MEDIAN,LARGE URBANIZED AREA,RURAL OR URBAN PRINCIPAL ARTERIAL,BOSTON (MA-NH-RI),MAINLINE ROADWAY,TWO-WAY TRAFFIC,NO ACCESS CONTROL,30.0,ARBORWAY,MURRAY CIRCLE,MORTON STREET,BOSTON,GOOD,LEVEL TERRAIN,PULLED BACK FROM HPMS NETWORK ESTIMATION ROUTINE,,0,0,0,PRINCIPAL ARTERIAL - OTHER,1,NO,57.0,"DCC1:NO IMPROPER DRIVING, DCC2:NOT REPORTED",NOT DISTRACTED,MA,NO,NO,"NO, NOT FEDERALLY REPORTABLE",NOT REPORTED,POSSIBLE INJURY (C),COLLISION WITH MOTOR VEHICLE IN TRAFFIC,3,TRAVELLING STRAIGHT AHEAD,"LIGHT TRUCK(VAN, MINI-VAN, PICKUP, SPORT UTILITY)",MDA1:LEFT SIDE,BOSTON,MA,MA,PAN,SEQ1:COLLISION WITH MOTOR VEHICLE IN TRAFFIC,"YES, OTHER REASON NOT DISABLED",JEEP,LIBERT,,EASTBOUND,,SOUTH STREET,2023,3,27,Monday,True
2023,4912089,5241795,BOSTON,03/27/2023,2023-03-27 10:22:00+00:00,OPEN,NON-FATAL INJURY,POSSIBLE INJURY (C),2,1,0,STATE POLICE,"SIDESWIPE, SAME DIRECTION",V1: TRAVELLING STRAIGHT AHEAD / V2: CHANGING LANES,V1: E  / V2: E,V1:(COLLISION WITH MOTOR VEHICLE IN TRAFFIC) V2:(COLLISION WITH MOTOR VEHICLE IN TRAFFIC),DAYLIGHT,CLEAR,DRY,COLLISION WITH MOTOR VEHICLE IN TRAFFIC,V1:(COLLISION WITH MOTOR VEHICLE IN TRAFFIC) / V2:(COLLISION WITH MOTOR VEHICLE IN TRAFFIC),D1: (NO IMPROPER DRIVING)  / D2: (FAILED TO YIELD RIGHT OF WAY),"V1:(LIGHT TRUCK(VAN, MINI-VAN, PICKUP, SPORT UTILITY)) / V2:(PASSENGER CAR)",,ARBORWAY / SOUTH STREET,,,,NOT AT JUNCTION,TRAFFIC CONTROL SIGNAL,"TWO-WAY, DIVIDED, UNPROTECTED MEDIAN",MASSACHUSETTS DEPARTMENT OF TRANSPORTATION,ROADWAY,,YES,AT INTERSECTION,231786.2037,894655.2407,42.30173216,-71.11450304,2023,D1: NOT DISTRACTED / D2: NOT DISTRACTED,6,MAPC,V1:(NO) / V2:(NO),"V1:(YES, OTHER REASON NOT DISABLED) / V2:(YES, OTHER REASON NOT DISABLED)",SUFFOLK,"V1:(NO, NOT FEDERALLY REPORTABLE) / V2:(NO, NOT FEDERALLY REPORTABLE)","NO, NOT FEDERALLY REPORTABLE",NO HIT AND RUN,,"NO, SCHOOL BUS NOT INVOLVED",30.0,"YES, DEVICE FUNCTIONING",NO,19453.0,2020,,,,,BOTH SIDES,0,6,0,NO SHOULDER,22,BITUMINOUS CONCRETE ROAD,0,NO SHOULDER,2,2,0,RAISED MEDIAN,LARGE URBANIZED AREA,RURAL OR URBAN PRINCIPAL ARTERIAL,BOSTON (MA-NH-RI),MAINLINE ROADWAY,TWO-WAY TRAFFIC,NO ACCESS CONTROL,30.0,ARBORWAY,MURRAY CIRCLE,MORTON STREET,BOSTON,GOOD,LEVEL TERRAIN,PULLED BACK FROM HPMS NETWORK ESTIMATION ROUTINE,,0,0,0,PRINCIPAL ARTERIAL - OTHER,2,NO,25.0,"DCC1:FAILED TO YIELD RIGHT OF WAY, DCC2:NOT REPORTED",NOT DISTRACTED,TX,NO,NO,"NO, NOT FEDERALLY REPORTABLE",NOT REPORTED,NO APPARENT INJURY (O),COLLISION WITH MOTOR VEHICLE IN TRAFFIC,1,CHANGING LANES,PASSENGER CAR,"MDA1:RIGHT FRONT, MDA2:RIGHT SIDE",LYNN,MA,MA,LVN,SEQ1:COLLISION WITH MOTOR VEHICLE IN TRAFFIC,"YES, OTHER REASON NOT DISABLED",CHEV,MALIBU,,EASTBOUND,,SOUTH STREET,2023,3,27,Monday,True
2023,4914430,5244763,BOSTON,02/09/2023,2023-02-09 08:30:00+00:00,OPEN,PROPERTY DAMAGE ONLY (NONE INJURED),NO APPARENT INJURY (O),2,0,0,LOCAL POLICE,REAR-END,V1: BACKING / V2: LEAVING TRAFFIC LANE,V1: N  / V2: N,V1:(COLLISION WITH MOTOR VEHICLE IN TRAFFIC) V2:(COLLISION WITH MOTOR VEHICLE IN TRAFFIC),DAYLIGHT,CLEAR,DRY,COLLISION WITH MOTOR VEHICLE IN TRAFFIC,V1:(COLLISION WITH MOTOR VEHICLE IN TRAFFIC) / V2:(COLLISION WITH MOTOR VEHICLE IN TRAFFIC),D1: (OTHER IMPROPER ACTION)  / D2: (FAILURE TO KEEP IN PROPER LANE OR RUNNING OFF ROAD),"V1:(LIGHT TRUCK(VAN, MINI-VAN, PICKUP, SPORT UTILITY)) / V2:(PASSENGER CAR)",3134,WASHINGTON STREET,,,,NOT AT JUNCTION,TRAFFIC CONTROL SIGNAL,"TWO-WAY, NOT DIVIDED",CITY OR TOWN ACCEPTED ROAD,SHOULDER - PAVED,,YES,OPERATOR DESIGNATED,232997.87113993,896060.74979228,42.31433537,-71.09972842,2023,D1: NOT DISTRACTED / D2: NOT DISTRACTED,6,MAPC,V1:(NO) / V2:(NO),V1:(NO) / V2:(NO),SUFFOLK,"V1:(NO, NOT FEDERALLY REPORTABLE) / V2:(NO, NOT FEDERALLY REPORTABLE)","NO, NOT FEDERALLY REPORTABLE",NO HIT AND RUN,TRAFFIC CONGESTION RELATED,"NO, SCHOOL BUS NOT INVOLVED",,NOT REPORTED,NO,11864.0,2020,0.33,462,0.105,130,BOTH SIDES,10,10,0,NO SHOULDER,28,BITUMINOUS CONCRETE ROAD,0,NO SHOULDER,2,0,0,,LARGE URBANIZED AREA,RURAL MINOR ARTERIAL OR URBAN PRINCIPAL ARTERIAL,BOSTON (MA-NH-RI),MAINLINE ROADWAY,TWO-WAY TRAFFIC,NO ACCESS CONTROL,30.0,WASHINGTON STREET,HYDE PARK AVENUE,DEVONSHIRE PLACE,BOSTON,FAIR,LEVEL TERRAIN,GROWN FROM PRIOR YEAR HPMS NETWORK,,30,0,0,PRINCIPAL ARTERIAL - OTHER,1,NO,,"DCC1:OTHER IMPROPER ACTION, DCC2:NOT REPORTED",NOT DISTRACTED,96,NO,NO,"NO, NOT FEDERALLY REPORTABLE",NOT REPORTED,NO APPARENT INJURY (O),COLLISION WITH MOTOR VEHICLE IN TRAFFIC,1,BACKING,"LIGHT TRUCK(VAN, MINI-VAN, PICKUP, SPORT UTILITY)",MDA1:LEFT REAR,JAMAICA PLAIN,MA,96,,SEQ1:COLLISION WITH MOTOR VEHICLE IN TRAFFIC,NO,FORD,GTX,,NORTHBOUND,,WASHINGTON STREET,2023,2,9,Thursday,False
2023,4914430,5244763,BOSTON,02/09/2023,2023-02-09 08:30:00+00:00,OPEN,PROPERTY DAMAGE ONLY (NONE INJURED),NO APPARENT INJURY (O),2,0,0,LOCAL POLICE,REAR-END,V1: BACKING / V2: LEAVING TRAFFIC LANE,V1: N  / V2: N,V1:(COLLISION WITH MOTOR VEHICLE IN TRAFFIC) V2:(COLLISION WITH MOTOR VEHICLE IN TRAFFIC),DAYLIGHT,CLEAR,DRY,COLLISION WITH MOTOR VEHICLE IN TRAFFIC,V1:(COLLISION WITH MOTOR VEHICLE IN TRAFFIC) / V2:(COLLISION WITH MOTOR VEHICLE IN TRAFFIC),D1: (OTHER IMPROPER ACTION)  / D2: (FAILURE TO KEEP IN PROPER LANE OR RUNNING OFF ROAD),"V1:(LIGHT TRUCK(VAN, MINI-VAN, PICKUP, SPORT UTILITY)) / V2:(PASSENGER CAR)",3134,WASHINGTON STREET,,,,NOT AT JUNCTION,TRAFFIC CONTROL SIGNAL,"TWO-WAY, NOT DIVIDED",CITY OR TOWN ACCEPTED ROAD,SHOULDER - PAVED,,YES,OPERATOR DESIGNATED,232997.87113993,896060.74979228,42.31433537,-71.09972842,2023,D1: NOT DISTRACTED / D2: NOT DISTRACTED,6,MAPC,V1:(NO) / V2:(NO),V1:(NO) / V2:(NO),SUFFOLK,"V1:(NO, NOT FEDERALLY REPORTABLE) / V2:(NO, NOT FEDERALLY REPORTABLE)","NO, NOT FEDERALLY REPORTABLE",NO HIT AND RUN,TRAFFIC CONGESTION RELATED,"NO, SCHOOL BUS NOT INVOLVED",,NOT REPORTED,NO,11864.0,2020,0.33,462,0.105,130,BOTH SIDES,10,10,0,NO SHOULDER,28,BITUMINOUS CONCRETE ROAD,0,NO SHOULDER,2,0,0,,LARGE URBANIZED AREA,RURAL MINOR ARTERIAL OR URBAN PRINCIPAL ARTERIAL,BOSTON (MA-NH-RI),MAINLINE ROADWAY,TWO-WAY TRAFFIC,NO ACCESS CONTROL,30.0,WASHINGTON STREET,HYDE PARK AVENUE,DEVONSHIRE PLACE,BOSTON,FAIR,LEVEL TERRAIN,GROWN FROM PRIOR YEAR HPMS NETWORK,,30,0,0,PRINCIPAL ARTERIAL - OTHER,2,NOT REPORTED,29.0,"DCC1:FAILURE TO KEEP IN PROPER LANE OR RUNNING OFF ROAD, DCC2:NOT REPORTED",NOT DISTRACTED,MA,NOT REPORTED,NO,"NO, NOT FEDERALLY REPORTABLE",NOT REPORTED,NO APPARENT INJURY (O),COLLISION WITH MOTOR VEHICLE IN TRAFFIC,1,LEAVING TRAFFIC LANE,PASSENGER CAR,MDA1:NONE,BOSTON,MA,96,PAN,SEQ1:COLLISION WITH MOTOR VEHICLE IN TRAFFIC,NO,TOYOTA,HIGHLANDER,,NORTHBOUND,,WASHINGTON STREET,2023,2,9,Thursday,False
2023,4914926,5244267,BOSTON,03/07/2023,2023-03-07 21:21:00+00:00,OPEN,NON-FATAL INJURY,SUSPECTED MINOR INJURY (B),3,3,0,LOCAL POLICE,HEAD-ON,V1: TRAVELLING STRAIGHT AHEAD / V2: TRAVELLING STRAIGHT AHEAD / V3: ENTERING TRAFFIC LANE,V1: S  / V2: S  / V3: N,V1:(COLLISION WITH MOTOR VEHICLE IN TRAFFIC) V2:(COLLISION WITH MOTOR VEHICLE IN TRAFFIC) V3:(COLLISION WITH MOTOR VEHICLE IN TRAFFIC),DUSK,CLEAR,DRY,COLLISION WITH MOTOR VEHICLE IN TRAFFIC,V1:(COLLISION WITH MOTOR VEHICLE IN TRAFFIC) / V2:(COLLISION WITH MOTOR VEHICLE IN TRAFFIC) / V3:(COLLISION WITH MOTOR VEHICLE IN TRAFFIC),D1: (NO IMPROPER DRIVING)  / D2: (NO IMPROPER DRIVING)  / D3: (FAILURE TO KEEP IN PROPER LANE OR RUNNING OFF ROAD),"V1:(LIGHT TRUCK(VAN, MINI-VAN, PICKUP, SPORT UTILITY)) / V2:(LIGHT TRUCK(VAN, MINI-VAN, PICKUP, SPORT UTILITY)) / V3:(LIGHT TRUCK(VAN, MINI-VAN, PICKUP, SPORT UTILITY))",,WASHINGTON ST RTE N  / WASHINGTON ST RTE S  / WASHINGTON ST RTE N,,WASHINGTON STREET RTE,,T-INTERSECTION,TRAFFIC CONTROL SIGNAL,NOT REPORTED,CITY OR TOWN ACCEPTED ROAD,ROADWAY,,YES,OFF INTERSECTION,231678.1342,894272.4052,42.29828995,-71.11583458,2023,,6,MAPC,V1:(NO) / V2:(NO) / V3:(NO),"V1:(YES, VEHICLE OR TRAILER DISABLED) / V2:(YES, VEHICLE OR TRAILER DISABLED) / V3:(YES, VEHICLE OR TRAILER DISABLED)",SUFFOLK,"V1:(NO, NOT FEDERALLY REPORTABLE) / V2:(NO, NOT FEDERALLY REPORTABLE) / V3:(NO, NOT FEDERALLY REPORTABLE)","NO, NOT FEDERALLY REPORTABLE",NO HIT AND RUN,,"NO, SCHOOL BUS NOT INVOLVED",,NOT REPORTED,,14717.0,2020,0.558,677,0.155,162,BOTH SIDES,8,8,0,NO SHOULDER,22,BITUMINOUS CONCRETE ROAD,0,NO SHOULDER,2,0,0,,LARGE URBANIZED AREA,RURAL MINOR ARTERIAL OR URBAN PRINCIPAL ARTERIAL,BOSTON (MA-NH-RI),MAINLINE ROADWAY,TWO-WAY TRAFFIC,NO ACCESS CONTROL,30.0,WASHINGTON STREET,DEDHAM TOWN LINE,SOUTH STREET,BOSTON,FAIR,LEVEL TERRAIN,PULLED BACK FROM HPMS NETWORK ESTIMATION ROUTINE,,30,0,0,PRINCIPAL ARTERIAL - OTHER,1,,40.0,"DCC1:NO IMPROPER DRIVING, DCC2:NOT REPORTED",,96,,NO,"NO, NOT FEDERALLY REPORTABLE",NOT REPORTED,SUSPECTED MINOR INJURY (B),COLLISION WITH MOTOR VEHICLE IN TRAFFIC,1,TRAVELLING STRAIGHT AHEAD,"LIGHT TRUCK(VAN, MINI-VAN, PICKUP, SPORT UTILITY)","MDA1:RIGHT FRONT, MDA2:LEFT FRONT, MDA3:CENTER FRONT",AVON,MA,96,PAN,SEQ1:COLLISION WITH MOTOR VEHICLE IN TRAFFIC,"YES, VEHICLE OR TRAILER DISABLED",BMW,X3,,SOUTHBOUND,,WASHINGTON STREET,2023,3,7,Tuesday,True
2023,4914926,5244267,BOSTON,03/07/2023,2023-03-07 21:21:00+00:00,OPEN,NON-FATAL INJURY,SUSPECTED MINOR INJURY (B),3,3,0,LOCAL POLICE,HEAD-ON,V1: TRAVELLING STRAIGHT AHEAD / V2: TRAVELLING STRAIGHT AHEAD / V3: ENTERING TRAFFIC LANE,V1: S  / V2: S  / V3: N,V1:(COLLISION WITH MOTOR VEHICLE IN TRAFFIC) V2:(COLLISION WITH MOTOR VEHICLE IN TRAFFIC) V3:(COLLISION WITH MOTOR VEHICLE IN TRAFFIC),DUSK,CLEAR,DRY,COLLISION WITH MOTOR VEHICLE IN TRAFFIC,V1:(COLLISION WITH MOTOR VEHICLE IN TRAFFIC) / V2:(COLLISION WITH MOTOR VEHICLE IN TRAFFIC) / V3:(COLLISION WITH MOTOR VEHICLE IN TRAFFIC),D1: (NO IMPROPER DRIVING)  / D2: (NO IMPROPER DRIVING)  / D3: (FAILURE TO KEEP IN PROPER LANE OR RUNNING OFF ROAD),"V1:(LIGHT TRUCK(VAN, MINI-VAN, PICKUP, SPORT UTILITY)) / V2:(LIGHT TRUCK(VAN, MINI-VAN, PICKUP, SPORT UTILITY)) / V3:(LIGHT TRUCK(VAN, MINI-VAN, PICKUP, SPORT UTILITY))",,WASHINGTON ST RTE N  / WASHINGTON ST RTE S  / WASHINGTON ST RTE N,,WASHINGTON STREET RTE,,T-INTERSECTION,TRAFFIC CONTROL SIGNAL,NOT REPORTED,CITY OR TOWN ACCEPTED ROAD,ROADWAY,,YES,OFF INTERSECTION,231678.1342,894272.4052,42.29828995,-71.11583458,2023,,6,MAPC,V1:(NO) / V2:(NO) / V3:(NO),"V1:(YES, VEHICLE OR TRAILER DISABLED) / V2:(YES, VEHICLE OR TRAILER DISABLED) / V3:(YES, VEHICLE OR TRAILER DISABLED)",SUFFOLK,"V1:(NO, NOT FEDERALLY REPORTABLE) / V2:(NO, NOT FEDERALLY REPORTABLE) / V3:(NO, NOT FEDERALLY REPORTABLE)","NO, NOT FEDERALLY REPORTABLE",NO HIT AND RUN,,"NO, SCHOOL BUS NOT INVOLVED",,NOT REPORTED,,14717.0,2020,0.558,677,0.155,162,BOTH SIDES,8,8,0,NO SHOULDER,22,BITUMINOUS CONCRETE ROAD,0,NO SHOULDER,2,0,0,,LARGE URBANIZED AREA,RURAL MINOR ARTERIAL OR URBAN PRINCIPAL ARTERIAL,BOSTON (MA-NH-RI),MAINLINE ROADWAY,TWO-WAY TRAFFIC,NO ACCESS CONTROL,30.0,WASHINGTON STREET,DEDHAM TOWN LINE,SOUTH STREET,BOSTON,FAIR,LEVEL TERRAIN,PULLED BACK FROM HPMS NETWORK ESTIMATION ROUTINE,,30,0,0,PRINCIPAL ARTERIAL - OTHER,2,,35.0,"DCC1:NO IMPROPER DRIVING, DCC2:NOT REPORTED",,MA,,NO,"NO, NOT FEDERALLY REPORTABLE",NOT REPORTED,POSSIBLE INJURY (C),COLLISION WITH MOTOR VEHICLE IN TRAFFIC,1,TRAVELLING STRAIGHT AHEAD,"LIGHT TRUCK(VAN, MINI-VAN, PICKUP, SPORT UTILITY)","MDA1:CENTER FRONT, MDA2:LEFT SIDE, MDA3:RIGHT FRONT",JAMAICA PLAIN,MA,96,PAN,SEQ1:COLLISION WITH MOTOR VEHICLE IN TRAFFIC,"YES, VEHICLE OR TRAILER DISABLED",JEEP,COMPASS,,SOUTHBOUND,,WASHINGTON STREET,2023,3,7,Tuesday,True
